Artist,Similar Artists
Jack Johnson,"Donavon Frankenreiter, John Mayer, Amos Lee, Jason Mraz, Ben Harper"
Vern Matz,"Butter Bath, Small Forward, Wallows, Tyler Burkhart, Goldensuns"
Justin Timberlake,"*NSYNC, Usher, Jennifer Lopez, Timbaland, Robin Thicke"
Bats,"Adebisi Shank, Alpha Male Tea Party, And So I Watch You From Afar, Q and Not U, The Physics House Band"
Diversify,"Base Hollow, Flannan, Susanne Davis, Muni, Harper Minta"
Daniel Johnston,"The Microphones, The Moldy Peaches, Jeff Mangum, Jeffrey Lewis, Neutral Milk Hotel"
The Decemberists,"Tarkio, Colin Meloy, The Shins, Okkervil River, The Mountain Goats"
Mk.gee,"DIJON, Chanel Beads, roy blair, Jai Paul, Choker"
Jesse Woods,"River Whyless, Michael Nau, Tim Hill, Cotton Jones, Fruit Bats"
Blondshell,"Samia, Bully, Momma, Indigo De Souza, Palehound"
Qing Madi,"Victony, Magixx, Young Jonn, Fireboy Dml, BNXN"
Gabry Ponte,"Prezioso, R3hab, Eiffel 65, OFENBACH, Kyanu"
Happy Just to See You,"Badfellows, OldSoul, Hell Beach, Rick Rude, Kitner"
Francis Flo,"Víolet Dawn, Barkérby, Skeru, Harry Bloom, Kal Koren"
Isbells,"Marble Sounds, Benjamin Francis Leftwich, Angus Stone, I am Oak, Blaudzun"
Joan as Police Woman,"Anna Calvi, Nadine Shah, Martha Wainwright, My Brightest Diamond, Emilíana Torrini"
The Rise of the Six: 1966–1972,"Aurora: 1977–1978, The Numbers Tour: 1976–1977, Seven Eight Nine: 1975–1976, Aurora World Tour: 1978–1979, Debut: 1973–1975"
Kalle Mattson,"Malin Kojola, Jess Delgado, Yo Preston (Featuring Kelly Kiara), Charity Vance, Josh Golden and Savannah Outen"
Sheer Mag,"Liquid Mike, Mannequin Pussy, Meatbodies, Ty Segall, Royal Headache"
Haiku Hands,"Elohim, Icona Pop, Sofi Tukker, Inji, The Ting Tings"
"Raveena, JPEGMAFIA","Vegyn, JPEGMAFIA, JPEGMAFIA, Denzel Curry, JPEGMAFIA, Vince Staples, JPEGMAFIA, Buzzy Lee, JPEGMAFIA, Helena Deland"
Carl Thomas,"Musiq, Avant, Case, Joe, Donell Jones"
Yigal,
sign crushes motorist,"Take Care, birth day, Hold, miserable teens club, i don't like mirrors"
Ting Tang Tina,"Reggie Pearl, Hiding Places, career woman, Red Theme, hi again"
NewDad,"Jfarrari, TTSSFU, Just Mustard, Whitelands, BDRMM"
Lilly Hiatt,"Amanda Shires, Jaime Wyatt, Caroline Spence, Kelsey Waldon, Margo Price"
gladie,"Cayetana, Remember Sports, ratboy, Laura Stevenson, Chris Farren"
Heartworms,"Nightbus, Deadletter, Dog Race, Chalk, Gurriers"
Vince Staples,"ScHoolboy Q, Isaiah Rashad, Denzel Curry, Jid, Smino"
The Family Crest,"Fish in a Birdcage, Aliceband, The Amazing Devil, The Crane Wives, The Oh Hellos"
Mort Stevens And His Orchestra,"The Royal Philharmonic Concert Orchestra, Daniel Caine Orchestra, Royal Philharmonic Concert Orchestra, London Television Orchestra, Gogglebox"
The Bug Club,"2nd Grade, Pip Blom, Personal Trainer, Being Dead, Bad Moves"
Jocelyn Mackenzie,"Jeremy Styles, Pearl and the Beard, Dream Team Laser Beam, Worship Service, Emily Hope Price"
Chapter Fifteen,"Chapter Thirteen, Chapter Sixteen, Chapter Fourteen, Chapter Twelve, Chapter Seventeen"
Kevin Devine,"Bad Books, Into It. Over It., All Get Out, Right Away, Great Captain!, Manchester Orchestra"
Johnnyswim,"Drew Holcomb & the Neighbors, The Lone Bellow, Wilder Woods, The Civil Wars, Penny and Sparrow"
Claire Rousay,"astrid sonne, More Eaze, Kara-Lis Coverdale, Tashi Wada, Kelly Moran"
Isak Danielson,"Winona Oak, Måns Zelmerlöw, MIIA, yaeow, Sandro Cavazza"
Mallrat,"Sycco, Allday, Cub Sport, Vera Blue, Jack River"
Enough Cereals,"Mac Kay, Rose Noir, Teddy Roxpin, Maximillian, Loyae, Aves"
Ryan Harris,"Ocie Elliott, Dustin Tebbutt, Ziggy Alberts, Amistat, Allman Brown"
King Isis,"Packs, Meernaa, Wallice, hannah jadagu, ill peach"
The Weepies,"Deb Talan, Alexi Murdoch, Ingrid Michaelson, Jaymay, Joshua Radin"
Maximiano,"Max Niemann, Long Mama, OLD PUP, Scam Likely, Diet Lite"
who is she?,"Lisa Prank, Upset, T-Rextasy, DUMP HIM, Smokey Brights"
Nightbird,"Hulda Huima, Ylva Haru, Viitasen Piia, Amuri, Mara Balls"
Nonpareils,"Moin, Dialect, Liars, Gum Takes Tooth, Suuns"
Epigraph,"Opening Credits, Chap 2, Chapter 31, Chapter 1, Chapter 32"
Mimber,"Skeru, Barkérby, Víolet Dawn, Francis Flo, Napolia"
Margo Guryan,"Lesley Gore, The Millennium, Wendy & Bonnie, The Feminine Complex, Cass Elliot"
Honey Cutt,
Rozwell Kid,"Antarctigo Vespucci, Chris Farren, Jeff Rosenstock, Pet Symmetry, Microwave"
Simon & Garfunkel,"Paul Simon, Bob Dylan, James Taylor, Peter, Paul & Mary, Don McLean"
Biig Piig,"Greentea Peng, Lava La Rue, Arlo Parks, Hope Tala, PIP MILLETT"
Mitski,"Fiona Apple, Sir Chloe, Lucy Dacus, Black Box Recorder, beabadoobee"
Rubber Band Gun,"Star Moles, Essential Forever, Winter McQuinn, John Myrtle, Mother Sun"
Boldy James,"Nicholas Craven, The Alchemist, Conway the Machine, Westside Gunn, Benny the Butcher"
The Rhythm Method,"Lime Garden, Spector, Tomato Flower, Middle Kids, Boeckner"
Sierra Ferrell,"Bella White, Emily Nenni, Charley Crockett, Nick Shoulders, Vincent Neil Emerson"
Thirty Seconds to Mars,"The Rasmus, Placebo, Dead By Sunrise, Papa Roach, Angels & Airwaves"
Altameda,"Scenic Route to Alaska, Ev Carm, Mariel Buckley, Sami Simon, Jack Bradley Vaught"
Dead Man's Bones,"The Decemberists, Other Lives, Okkervil River, Junip, Torres"
Balu Brigada,"Twenty One Pilots, Coin, Devon Again, jelani aryeh, benee"
Adeem the Artist,"Ruston Kelly, Jason Isbell and The 400 Unit, Jason Isbell, Katie Pruitt, American Aquarium"
Indigo De Souza,"Samia, Julia Jacklin, Snail Mail, Wednesday, Lucy Dacus"
Chelsea Days,"Glom, Scoobert Doobert, Cal in Red, Lutalo, JW Francis"
Andy Bell,"Erasure, Book Of Love, Electronic, Pet Shop Boys, Steve Mason"
Makzo,"Parkbench Epiphany, Sitting Duck, Gustav Gustav, TESK, eaup"
Miniature Tigers,"The Happy Fits, Jukebox the Ghost, Ricky Montgomery, Mustard Service, Voxtrot"
Michel Bouwmans,"Big Dopes, Andrea Valentini, Max McDermott, Steve the Trailplayer, Marmalade Mountain"
Mustafa,"Sampha, Charlotte Day Wilson, Fousheé, Jonah Yano, James Blake & Lil Yachty"
The Postal Service,"Death Cab for Cutie, Ben Gibbard, The Shins, Dntel, Passion Pit"
Dear Maryanne,"trsh, Thoughts on Bowling, Harrison Gordon, Carpool, Free Throw"
Glitterer,"Fiddlehead, Militarie Gun, Anxious, Ovlov, Liquid Mike"
Handsome Boy Modeling School,"Lovage, Dr. Octagon, Deltron 3030, Del Tha Funkee Homosapien, Blackalicious"
Janos Sebestyen,"Karoly Botvay, Franz Liszt, Béla Bartók, Carl Philipp Emanuel Bach, Arcangelo Corelli"
Mateo Messina,"Antsy Pants, Barry Louis Polisar, Kimya Dawson, The Moldy Peaches, Jon Brion"
Cannons,"New Constellations, The Knocks, Poolside, Leisure, Blow"
Origami Angel,"Prince Daddy & The Hyena, Equipment, Ben Quad, Michael Cera Palin, saturdays at your place"
"Bright Eyes, Waxahatchee","Bright Eyes, Phoebe Bridgers, Son, Ambulance, Bright Eyes, Z Berg, Ryan Ross, The Young Veins, Z Berg, Conor Oberst and the Mystic Valley Band, Conor Oberst"
DJ DangerMouse,"wu tang vs the beatles, dj BC, CCC, Adrian Champion, Team Teamwork"
Lunar Noon,"Susanna Hoffs, El Hardwick, Joan Armatrading, Mieke Miami, Uto"
Tia Lou,
Kim Wilde,"Bananarama, Samantha Fox, Belinda Carlisle, Five Star, Bucks Fizz"
David Bowie,"Tin Machine, Iggy Pop, T. Rex, Lou Reed, Roxy Music"
SOUs-sOL,"Ed Maverick, Mi Sobrino Memo, Jósean Log, Arroba Nat, Daniel Quién"
N.W.A,"Eazy-E, Ice Cube, Dr. Dre, The D.O.C., MC Ren"
Fireboy DML,
Slim Loris,"Addy Baddy, Hector Gannet, Facula, Joe Kelly & The Royal Pharmacy, Wretched Pinhead Puppets"
Lisel,"Patchnotes, Purple Pilgrims, Kate Teague, Kalbells, Maria Usbeck"
Måneskin,"Palaye Royale, Mahmood, The Pretty Reckless, The Struts, The Kolors"
Better Oblivion Community Center,"Boygenius, Phoebe Bridgers, Lucy Dacus, Julien Baker, Conor Oberst"
Sid Sriram,"Karthik, Anurag Kulkarni, Anirudh Ravichander, Yazin nizar, Haricharan"
Sloppy Jane,"Frances Quinlan, Better Oblivion Community Center, Lucy Dacus, Boygenius, Julien Baker"
Pyotr Ilyich Tchaikovsky,"Camille Saint-Saëns, Antonín Dvořák, Sergei Prokofiev, Johannes Brahms, Felix Mendelssohn"
Deux Visages,"Chokecherry, Forest, Julie, Raue, Poise"
Iggy Pop,"The Stooges, Iggy Pop & James Williamson, Lou Reed, David Bowie, Patti Smith"
Trace Mountains,"LVL UP, ratboy, This is Lorelei, Hovvdy, Wishy"
LaVern,"Nyday, Rscl, Y.V.E. 48, Palastic, Falden"
Method Man,"Inspectah Deck, Raekwon, Method Man & Redman, Wu-Tang Clan, Ol' Dirty Bastard"
Julien Baker,"Lucy Dacus, Boygenius, Phoebe Bridgers, Better Oblivion Community Center, Tomberlin"
Amy O,"Mary Timony, Gregory and the Hawk, Girl Ray, BABEHOVEN, Becca Mancari"
Olivia Rodrigo,"Sabrina Carpenter, Taylor Swift, Gracie Abrams, Billie Eilish, Chappell Roan"
AJ Fullerton,"Trainman Blues, Michael Van Merwyk, Laura Evans, Rī Wolf, Lloyd Spiegel"
Chapter Thirty-two,
Raphael Whalen,
J Hus,"NSG, MOSTACK, Headie One, Fredo, Dave"
Slug,"Atmosphere, Brother Ali, Eyedea & Abilities, Living Legends, Sage Francis"
Taylor Acorn,"Arrows in Action, Honey Revenge, Charlotte Sands, hot milk, RØRY"
George Reid,"Glimji, Kissimjau, cell m8, aimei 媚, Clarcq"
Mavi,"Navy Blue, Mike, Messiah!, ovrkast., Earl Sweatshirt"
Okkervil River,"Will Sheff, Shearwater, Conor Oberst, Bright Eyes, Wolf Parade"
Bea And Her Business,
Grian Chatten,"Julie Byrne, Gaz Coombes, Baxter Dury, Kevin Morby, This Is the Kit"
Pile,"Krill, Ovlov, Kal Marks, Big Ups, LVL UP"
Hermeto Pascoal,"Egberto Gismonti, Quarteto Novo, Edu Lobo, Tom Zé, João Donato"
The Notorious B.I.G.,"2Pac, Dr. Dre, Mobb Deep, Big L, Jay-Z"
Reggie Becton,"PHABO, Kevin Ross, JVCK JAMES, Kenyon Dixon, Nbdy"
Cassandra Jenkins,"Jessica Pratt, Waxahatchee, The Weather Station, Nilüfer Yanya, Rosali"
Ryan Gebhardt,"Chelsea Days, Mustard Service, Frog, Palace, Vern Matz"
Reyna Tropical,"Helado Negro, LA LOM, Dos Santos, Bomba Estéreo, Hermanos Gutiérrez"
Phox,"Andrew Bird, Lucius, M. Ward, monica martin, Rubblebucket"
Theo Bleak,"Etta Marcus, Abby Sage, runo plum, Prima Queen, Bel"
Icee Red,"Fourté, WESLEYFRANKLIN, Remi Soul, HMLT, Malia Laura"
"NxWorries, Anderson .Paak, Knxwledge","NxWorries, Anderson .Paak, Knxwledge, The Last Artful, Dodgr, NxWorries, Anderson .Paak, Knxwledge, Dave Chappelle, NxWorries, Anderson .Paak, H.E.R., Knxwledge, NxWorries, Anderson .Paak, Knxwledge, Earl Sweatshirt, Rae Khalil, NxWorries, Anderson .Paak, Knxwledge, Thundercat"
The Ink Spots,"Bob Crosby And The Bobcats, Jack Shaindlin, Betty Hutton, Bob Crosby, The Mills Brothers"
Delaney Davidson,"Marlon Williams, The Bones of J.R. Jones, Lucette, Eilen Jewell, The Be Good Tanyas"
Mickey Guyton,"Tiera Kennedy, MacKenzie Porter, Ashley McBryde, Maddie & Tae, Carly Pearce"
"Benny Andersson, Björn Ulvaeus, Siobhan McCarthy, The Dynamos","Benny Andersson, Björn Ulvaeus, Lisa Stokke, Hilton McRae, Paul Clarkson, Nicolas Colicos, Benny Andersson, Björn Ulvaeus, Stig Anderson, Siobhan McCarthy, Nicolas Colicos, Paul Clarkson, Hilton McRae, Benny Andersson, Björn Ulvaeus, Stig Anderson, Jenny Galloway, Louise Plowright, Siobhan McCarthy, Benny Andersson, Björn Ulvaeus, Jenny Galloway, Louise Plowright, Siobhan McCarthy, Benny Andersson, Björn Ulvaeus, Siobhan McCarthy, Louise Plowright, Jenny Galloway, Neal Wright"
Sea Elephant,"Jackson Harden, Gaya Yona, Erika Wester, Carl Schilde, The Circulars"
Emilíana Torrini,"Ane Brun, Bat for Lashes, Sophie Hunger, Joan as Police Woman, Emilie Simon"
Bonneville,"The Slapbacks, Bob & The Bearcats, Crazy Cavan & The Rhythm Rockers, Teencats, Johnny & the roccos"
Gabi Hartmann,"Youn Sun Nah, Cyrille Aimée, Cécile McLorin Salvant, Stacey Kent, Melody Gardot"
The Walters,
Allen Tate,"Behaviorist, Kwesi Foraes, Cameron AG, Great Danes, Youth in a Roman Field"
Pash,"LOUJAY, Zoe Rex, Jessica Peros, Paul Michel, Bryce Panic"
frown line,"buffchick, career woman, Ok Cowgirl, Blair Lee, Homeschool"
t.A.T.u.,"Lena Katina, Serebro, Линда, Винтаж, Reflex"
Will Stewart,"Cactus Lee, The Pink Stones, Scott Ballew, Michigan Rattlers, The Sons of Rainier"
Emmy Jo,"Freedom Fry, Diego Garcia, Hauskey, Bodies of Water, Andrea von Kampen"
Dabin,"Seven Lions, Said The Sky, Illenium, ARMNHMR, MitiS"
AHI,"Aisha Badru, Beta Radio, Mipso, John Smith, Rosie Carney"
Little Stranger,"Tropidelic, The Dirty Heads, The Elovaters, DENM, Surfer Girl"
Chapter Twelve,"Chapter Ten, Chapter Thirteen, chapter nine, Chapter Sixteen, Chapter Fifteen"
cocabona,"Sleepy Fish, yourneighborsclassicbeats, Yasper, Mrs. Evergreen, DRWN."
Corey Kent,"Kameron Marlowe, Bailey Zimmerman, Dylan Scott, Tyler Hubbard, Jordan Davis"
Abra,"Kilo Kish, Kelela, Ojerime, Tei Shi, Rochelle Jordan"
Green Day,"Foxboro Hot Tubs, The Network, Pinhead Gunpowder, Billie Joe Armstrong, blink-182"
The Palms,"Foreign Air, Meltt, Electric Guest, Coast Modern, Matt Maeson"
toe,"a picture of her, Via Luna, 3nd, Lite, Foster Parents"
Pacific Air,"Wolf Gang, Magic Man, Youngblood Hawke, Broken Bells, Dan Croll"
The Pillows,"ASIAN KUNG-FU GENERATION, MASS OF THE FERMENTING DREGS, NUMBER GIRL, くるり, Supercar"
Tucker Zimmerman,"The Weather Station, Judee Sill, AdriAnne Lenker, Cameron Winter, Allegra Krieger"
Hundred Waters,"Braids, Kishi Bashi, Glasser, Poliça, Half Waif"
Kelli Nicole,"Tum, Sgt.fiasco, Futon Blonde, The Ugly Fun, Edison Gómez-Krauss"
Lola Young,"Rachel Chinouriri, Remi Wolf, Olivia Dean, Maggie Rogers, Raye"
David Hedderman,"Danny Carroll, Niamh Regan, BadHands, Stray Planets, BRÍDÍN"
"Swum, Benno",
Dessa,"Doomtree, Sims, P.O.S., Cecil Otter, Astronautalis"
J.E. Sunde,"H-burns, Buck Meek, Grian Chatten, Helena Deland, Jonathan Jeremiah"
Reba McEntire,"Martina McBride, Lorrie Morgan, Trisha Yearwood, Wynonna Judd, Pam Tillis"
kierst,"In My Lungs, SUB*T, TummyAche, Melody English, Children Of The Pope"
Joy Oladokun,"Allison Russell, Brandi Carlile, Trousdale, Jensen McRae, Maggie Rogers"
Mae Simpson,"Clare Doyle, Nathaniel Rateliff and the Night Sweats, Lucy Michelle, Armchair Boogie, Sonny Knight and the Lakers"
Chapter Six,"Chapter Eight, Chapter Seven, Chapter Four, chapter nine, Chapter Three"
MADDY 매디,"설아, Ager, Maddy, Jae Jung Parc, Jimin Park"
MOTO BANDIT,"Beach Vacation, Indigo Waves, ARVERNE, Grazer, Swiss Portrait"
Zach Bryan,"Tyler Childers, Charles Wesley Godwin, Sam Barber, Wyatt Flores, Dylan Gossett"
Hudson Westbrook,"Vincent Mason, Zach Top, Gavin Adcock, Sam Barber, Ole 60"
Panda Bear,"Animal Collective, Avey Tare, Deakin, Avey Tare's Slasher Flicks, Atlas Sound"
A Giant Dog,"Bleached, Screaming Females, Sheer Mag, King Tuff, Tacocat"
deary,"Whitelands, Three Quarter Skies, Emma Anderson, Mo Dotti, The Fauns"
The Dirty Guv'nahs,"The Vegabonds, Ponderosa, The Benjy Davis Project, JJ Grey, Thieving Birds"
Lankum,"ØXN, Lisa O'Neill, John Francis Flynn, The Mary Wallopers, Ye Vagabonds"
Matt Pond PA,"Rogue Wave, Maritime, Longwave, Guster, The Long Winters"
St. Yuma,"Doug Tuttle, Tv Star, Quarter-Life Crisis, Matthew Logan Vasquez, Seer Believer"
Patio,"Wombo, Omni, Sweeping Promises, Lithics, Deeper"
Jaime Wyatt,"Kelsey Waldon, Natalie Hemby, Margo Price, Emily Nenni, Nikki Lane"
Yo La Tengo,"Built to Spill, Galaxie 500, Pavement, Stereolab, The Sea and Cake"
Dream Wife,"Skating Polly, Coach Party, Be Your Own Pet, The Big Moon, Bully"
Pinegrove,"Slaughter Beach, Dog, oso oso, The Hotelier, Modern Baseball, macseal"
Khalid,"6LACK, bazzi, Alina Baraz, omar apollo, H.E.R."
Chapter Eighteen,"Chapter Sixteen, Chapter Seventeen, Chapter Twenty-One, Chapter Twenty-Two, Chapter Twenty"
Shovels & Rope,"Parker Millsap, Justin Townes Earle, Hayes Carll, The Avett Brothers, Jamestown Revival"
Reneé Rapp,"Avantika, Fletcher, Bebe Wood, Maisie Peters, Lizzy McAlpine"
Jeff Goldblum,"The Wicked Orchestra, Kristin Chenoweth & Idina Menzel, Stephen Schwartz, Joel Grey, Wicked Movie Cast"
Marina Allen,"Marta Del Grandi, Isobel Campbell, Allegra Krieger, Dana Gavanski, Margaux"
Los Del Rio,"Lou Bega, Las Ketchup, Kaoma, Crazy Frog, Ricky Martin"
Ex-Vöid,"Joanna Gruesome, Trust Fund, The Bug Club, 2nd Grade, Kim Deal"
Jesse Labelle,"Trevor Guthrie, Taylor  Mathews, High Dive Heart, Shane Harper, Poema"
Eurythmics,"Annie Lennox, Fine Young Cannibals, The Human League, Frankie Goes to Hollywood, Howard Jones"
The Submarines,"Stars, Mates of State, The Blow, Eisley, Bishop Allen"
Jennah Bell,"Jaime Woods, Purple Ferdinand, Levi Stephens, Andy Allo, SIPPRELL"
Blondfire,"NONONO, The Colourist, Florrie, The Sounds, Haerts"
Queens of the Stone Age,"Them Crooked Vultures, Desert Sessions, Eagles of Death Metal, Kyuss, Royal Blood"
Chapter Thirty-three,
Beau,"kein, バビロン, サウイフモノ, Klein Kaiser, cali≠gari"
Yeasayer,"Bear in Heaven, Django Django, Wild Beasts, Grizzly Bear, Dirty Projectors"
Halsey,"Tove Lo, Gracie Abrams, Bea Miller, Hayley Kiyoko, Camila Cabello"
Big Thief,"AdriAnne Lenker, Buck Meek, Haley Heynderickx, Julia Jacklin, Lomelda"
savoy ellis,
Lascko,"chromo, the dreamer, BAO, Boukas, When Mountains Move, Venuz Beats"
Isaac Delusion,"Agar Agar, Kid Francescoli, Papooz, Poolside, Polo & Pan"
Sia,"Adele, Birdy, P!nk, Bebe Rexha, Jessie J"
Chapter Twenty-nine,
Kacey Musgraves,"Maren Morris, Kelsea Ballerini, Maggie Rogers, Miranda Lambert, The Chicks"
Daughter,"Ex:Re, Lanterns on the Lake, Syd Matters, Lucy Rose, Angus & Julia Stone"
Sam Gendel,"Sam Wilkes, Duval Timothy, Fabiano do Nascimento, Sam Gendel, Sam Wilkes, Makaya McCraven"
Flea,"Ataxia, Red Hot Chili Peppers, Omar Rodríguez-López, Banyan, Oysterhead"
Open Blue Sky,"Poella, Slow Rising Hope, Limelight Glow, Harmony Night, Melody Lake"
Fake Fruit,"Silverbacks, Wishy, Robber Robber, Being Dead, Cola"
Meshell Ndegeocello,"Bilal, Lizz Wright, Amel Larrieux, Rosie Lowe, José James"
Grumpy,"mr. silent, Lil Sic, soldier ink, Conejo, Ese Villen & Lysto"
Mike Shinoda,"Fort Minor, Dead By Sunrise, Linkin Park, Jay-Z and Linkin Park, Styles of Beyond"
Alfie Templeman,"Declan Mckenna, Cassia, Dayglow, apre, Sea Girls"
Steve Lacy,"The Internet, Daniel Caesar, Frank Ocean, Sonder, Thundercat"
Del Paxton,"Gulfer, short fictions, Magazine Beach, Taking Meds, Prawn"
Ravyn Lenae,"Solange, Raveena, Kelela, Rochelle Jordan, Mereba"
Being Dead,"The Hard Quartet, Dummy, Kim Deal, Fake Fruit, This is Lorelei"
The New Rising Sons,"Metroschifter, LaSalle, Stanford Prison Experiment, Decahedron, Kid Kilowatt"
Yeah Yeah Yeahs,"Metric, The Kills, TV on the Radio, Santigold, Karen O"
Bishop Briggs,"X Ambassadors, K.Flay, MisterWives, Sam Tinnesz, Gin Wigmore"
Shuggie Otis,"Cymande, Darondo, Syl Johnson, Sly & The Family Stone, Eddie Hazel"
Talib Kweli,"Reflection Eternal, Black Star, Talib Kweli & Hi-Tek, The Roots, Common"
Vegyn,"John Glacier, Oli XL, Mount Kimbie, TweakS, DOWNHILL2k01"
Marcus King,"The Marcus King Band, Tedeschi Trucks Band, Gary Clark Jr., JJ Grey & Mofro, Fantastic Negrito"
Michael Cera,"WHATEVER, DAD, The Moldy Peaches, Kimya Dawson, German Error Message, Cyberbully Mom Club"
DJ Bostan,
Sara Bareilles,"Ingrid Michaelson, Brandi Carlile, Anna Nalick, Colbie Caillat, A Fine Frenzy"
Julie Byrne,"Joanna Sternberg, Jess Williamson, Helena Deland, Kara Jackson, Tomberlin"
Chicago,"The Doobie Brothers, Peter Cetera, Little River Band, Styx, Boston"
War,"Eric Burdon & WAR, Ohio Players, Sly & The Family Stone, Mandrill, Funkadelic"
Zach Pietrini,"Mantlepiece, Paul Corliss, Tim Menchu, Matias and the Canyons, Jacey Hamill"
Loyle Carner,"Kofi Stone, KnuckS, LAUSSE THE CAT, Frankie Stew and Harvey Gunn, Bakar"
Nine Inch Nails,"How to Destroy Angels, Trent Reznor and Atticus Ross, Skinny Puppy, Gravity Kills, Filter"
Wand,"Cory Hanson, Meatbodies, Thee Oh Sees, Fuzz, Ty Segall"
People Taking Pictures,"Muunjuun, Drakkar Nowhere, Harrison Fjord, Acid Carousel, Send Medicine"
The Band Willa,"Cole Scheifele, Justin Lee, The National Forest, Hot Left Pole, The Neighborly"
Catfish and the Bottlemen,
Everyone Asked About You,"Ribbon Fix, Eldritch Anisette, Strictly Ballroom, 125 Rue Montmartre, I Hate Myself"
Afroham,"J.Folk, Kissamilé, vhsceral, C Y G N, Illiterate"
Ethel Cain,"Nicole Dollanganger, Vyva Melinkolya, 1017 ALYX 9SM, flower face, Wulven"
Ben Gibbard,"All-Time Quarterback, Death Cab for Cutie, The Postal Service, John K. Samson, Conor Oberst"
Leith Ross,"searows, Delaney Bailey, Lucy Dacus, Phoebe Bridgers, Lizzy McAlpine"
Misfits,"Blitzkid, Samhain, Black Flag, Minor Threat, T.S.O.L."
112,"Dru Hill, Jagged Edge, Donell Jones, Next, Joe"
Louaminé,"Kirabuo, Auðura, Fluvis, Garden Collective, Niveous"
Tank and the Bangas,"Moonchild, Me'Shell Ndegéocello, Durand Bernarr, KAMAUU, Kirby"
Band Reeves,"jd shelburne, Eric Van Zant, Jason Lee McKinney Band, Styles Haury, Greylan James"
Mr. Sam & the People People,"The Sons of Rainier, Chris Acker, Sam Doores, Duff Thompson, Cactus Lee"
Kieran Campbell,"Max García Conover, Titus Haug, Clover County, Palmyra, The Halfway Kid"
Tall Heights,"Beta Radio, Birdtalker, Sons Of The East, Roo Panes, Henry Jamison"
RØRY,"Taylor Acorn, Charlotte Sands, hot milk, Honey Revenge, Arrows in Action"
Lazā,"nolais, Oniimukuu, Tha Crescent, cedar redd, Remi Soul"
Giorgos Katsaros,"Markos Melkon, Kostas Roukounas, Takis Binis, Harilaos Kritikos, A. Kostis"
TV Smith,"Newtown Neurotics, Suburban Studs, TV Smith & the Bored Teenagers, Goldblade, Guitar Gangsters"
Parcels,"Franc Moody, L'Impératrice, Poolside, Miami Horror, The Whitest Boy Alive"
Nymano,"zmeyev, Glimlip, Philanthrope, Engelwood, Gyvus"
Dolly Parton,"Porter Wagoner & Dolly Parton, Loretta Lynn, Tammy Wynette, Kenny Rogers & Dolly Parton, Reba McEntire"
"Andrew Bird, Madison Cunningham","Bright Eyes, Cat Power, Andrew Bird, Alan Hampton, Ted Poor, Jon Hopkins, Ishq, Jamie xx, Romy, Oliver Sim, The xx, Panda Bear, Cindy Lee"
Eric Legnini Trio,"Joel Lyssarides, Jacky Terrasson, Aldo Romano, Fred Nardin Trio, Michel Portal"
Soak,"Baby Queen, Ezra williams, Miya Folick, Lauran Hibberd, Orla Gartland"
Wilhelm Tell Me,"Castlecomer, Penguin Prison, Satellite Stories, Atlas Genius, Max Frost"
No Excuses,"Kids Like Us, Christ all fucking mighty, The Mongoloids, Know The Score, Jump The Shark"
Dj Gummy Bear,
Ra Ra Riot,"Tokyo Police Club, Generationals, Rogue Wave, Stars, Someone Still Loves You Boris Yeltsin"
Crystal Canyon,"Soft Science, The Fauns, seablite, we melt chocolate, SWiiMS"
A R I Z O N A,"Frenship, AyokAy, Fly By Midnight, Midnight Kids, Quinn XCII"
Sly Jr.,"Ethansroom, More&More, thebandfriday, New Translations, frown line"
Fiji Blue,"Mokita, Mina Okabe, Fly By Midnight, Zachary Knowles, Lauv"
Taylor Swift,"Olivia Rodrigo, Gracie Abrams, Sabrina Carpenter, Chappell Roan, Maisie Peters"
Madska,"addie dunworth, Mary Middlefield, {{{iii}}}, Proper Youth, Jazzie Young"
Cereus Bright,"Morningsiders, The Hunts, Birdtalker, The Collection, Oliver Hazard"
Ferry Townes,"The Assassins, The Heathens, Fia James, MIRDJO, Eliza Harrison Smith"
Ckay,"Omah Lay, JOEBOY, 1da Banton, Oxlade, Victony"
Mercy Union,"13 Crowes, The Penske File, Ship Thieves, American Thrills, Arms Aloft"
Yard Act,"English Teacher, Courting, Deadletter, Sprints, Folly Group"
Squirrel Flower,
Harmony,"Theocracy, Narnia, Signum Regis, InnerWish, Darkwater"
King George,"Boosie Badazz, Finesse2tymes, Big Mike, Daz Dillinger, Geto Boys"
TTNG,"This Town Needs Guns, Delta Sleep, Hikes, Floral, Tangled Hair"
Spoon,"Divine Fits, The Shins, The Walkmen, Wolf Parade, Wilco"
Reuben Bidez,"Sam Lewis, Jacob Thomas Jr., Robby Hecht, Ian Felice, Thomas Csorba"
Rogê,"João Selva, Bruno Berle, Lucas Santtana, Marcos Valle, Rosinha de Valença"
SALES,"no vacation, mellow fellow, Yot Club, Bedroom, Far Caspian"
Still Woozy,"Current Blue, Goth Babe, Jawny, Dominic Fike, Monsune"
Hayden Pedigo,"North Americans, William Tyler, suss, Nathan Salsburg, Chuck Johnson"
Dear Rouge,"Monowhales, Arkells, July Talk, JJ Wilde, Hollerado"
The Kooks,"The Wombats, Razorlight, The Pigeon Detectives, Kaiser Chiefs, The Fratellis"
Delicate Steve,"William Tyler, Ratatat, El Ten Eleven, Starfucker, KUNZITE"
Young Franco,"Joe Hertz, Jafunk, Winston Surfshirt, Franc Moody, Tentendo"
pleasure systems,
Big Dopes,"Fawnn, 24thankyou, OxEye Daisy, career woman, Elephant Jake"
Kimya Dawson,"The Moldy Peaches, Antsy Pants, Barry Louis Polisar, Mateo Messina, Jeffrey Lewis"
Spirit of the Beehive,"the spirit of the beehive, They Are Gutting a Body of Water, Horse Jumper of Love, Ovlov, Wishy"
Richard Swift,"Damien Jurado, Kevin Morby, Michael Nau, Cotton Jones, Fruit Bats"
oso oso,"macseal, Prince Daddy & The Hyena, The Hotelier, Combat, arm's length"
2nd Grade,"Mo Troper, Liquid Mike, This is Lorelei, Wild Pink, Anna McClellan"
Joey Valence & Brae,"Logic, JPEGMAFIA, BROCKHAMPTON, Beastie Boys, Denzel Curry"
A. Savage,"Bonny Doon, Silver Jews, Kevin Morby, Buck Meek, Empty Country"
girl in red,
Iron & Wine,"Iron & Wine and Calexico, Alexi Murdoch, Horse Feathers, Blind Pilot, M. Ward"
OutKast,"Jay-Z, A Tribe Called Quest, Mos Def, Goodie Mob, The Roots"
Lady Gaga,"Ke$ha, Madonna, Katy Perry, Britney Spears, Miley Cyrus"
Carter Vail,"adan diaz, Sure Sure, Noah Floersch, Phoneboy, The Happy Fits"
Peaness,"cheerbleederz, Fightmilk, Fortitude Valley, Happy Accidents, Priestgate"
Superheaven,"Daylight, Narrow Head, Soul Blind, Scarlet House, Webbed Wing"
Godspeed You! Black Emperor,"A Silver Mt. Zion, Set Fire to Flames, Swans, Do Make Say Think, Mogwai"
Sideshow,"Summer 2000, Jim Legxacy, Chuck Strangers, ovrkast., Mike"
Girls Aloud,"The Saturdays, Sugababes, Cheryl, Nadine Coyle, Rachel Stevens"
"Action Bronson, Statik Selektah, Nina Sky","Action Bronson, Statik Selektah, Meyhem Lauren, Action Bronson, Statik Selektah, LIL Fame!!!, Action Bronson, Statik Selektah, Meyhem Lauren, Maffew Ragazino, AG Da Coroner, Action Bronson, Hologram, Action Bronson, Big Body Bes"
Holy Pinto,"Runaway Brother, Mikey Erg, Trapper Schoepp, Diva Sweetly, Stuck Out Here"
SWMRS,
Colter Wall,"Tyler Childers, Charley Crockett, Vincent Neil Emerson, Brent Cobb, The SteelDrivers"
Divorce,"Chalk, Enola Gay, Ditz, Drahla, Just Mustard"
Anderson .Paak,"Nxworries, Free Nationals, Isaiah Rashad, Smino, Big K.R.I.T."
