Artist,Similar Artists
The Avalanches,"DJ Shadow, LCD Soundsystem, Justice, Flying Lotus, Cornelius"
Crystal Rose,"Above and Beyond presents Ocea, Tushar Mathur, Christophe Fontana Feat. Tiya, Ivey Amour, Notrous Oxide"
Chapter One,"Chapter Three, Chapter Four, Chapter Six, Chapter Eight, Chapter Seven"
SwuM,
IDLES,
Charles Bradley,"Menahan Street Band, Sharon Jones and the Dap-Kings, Lee Fields & The Expressions, Saun & Starr, The James Hunter Six"
Martin Garrix,"Alesso, Hardwell, DubVision, Axwell /\ Ingrosso, Afrojack"
Nala Sinephro,"Nubya Garcia, Total Blue, astrid sonne, Milan W., Shabaka"
Samara Joy,"Cécile McLorin Salvant, Pasquale Grasso, Jazzmeia Horn, Sarah McKenzie, Stacey Kent"
Kate Hudson,"Christina Aguilera, Lil' Kim, Mýa & P!nk, Lady Gaga & Bradley Cooper, Loren Allred, The Wicked Orchestra, The Newton Brothers"
ØZWALD,"Jason Wade, Scoobert Doobert, Chelsea Days, Goofy Geese, Aaron Joseph Russo"
Dijon,
Diddy,"Diddy - Dirty Money, Ja Rule, B2K, P. Diddy, Nelly"
Cordae,"EarthGang, Jid, J. Cole, Bas, Logic"
Wombo,"Cola, Sneaks, Deeper, Packs, Stuck"
Mathias Oskarsson,"Gina Wood, Max Pasquarelli, Chivicke, Lecktric, Deep Sky Musics"
Gwenno,"Gruff Rhys, Katy J Pearson, Gorky's Zygotic Mynci, the orielles, Girl Ray"
Craig Finn,"The Hold Steady, Jesse Malin, Kevin Devine, Jeff Tweedy, Waxahatchee"
Lowswimmer,"Novo Amor, S. Carey, Axel Flóvent, Jolé, Foreign Fields"
Lizzo,"Meghan Trainor, Qveen Herby, Iggy Azalea, Fergie, Cardi B"
Bully,"ratboy, Palehound, Momma, Blondshell, Speedy Ortiz"
John Moreland,"American Aquarium, Justin Townes Earle, Jason Isbell, Jason Isbell and The 400 Unit, Joe Pug"
The Low Anthem,"Bowerbirds, Damien Jurado, Horse Feathers, Josh Ritter, The Cave Singers"
M.I.A.,"Azealia Banks, Rye Rye, Arca, Santigold, Robyn"
Sprints,"Folly Group, Yard Act, English Teacher, Deadletter, The Murder Capital"
Generation X,"The Vibrators, Billy Idol, Stiff Little Fingers, The Ruts, The Adverts"
Jay Smith,"Takida, Nik Ammar, Fool's Garden, Smash Into Pieces, Eagle-Eye Cherry"
Mat Kearney,"Matt Nathanson, Joshua Radin, Jon Foreman, Andrew Belle, Greg Laswell"
Shred Flintstone,"Tula Vera, Steve., Family Dinner, Cosmit, Ting Tang Tina"
Franz Ferdinand,"Kaiser Chiefs, FFS, Kasabian, The Fratellis, Interpol"
Olivia Dean,"Joesef, Joy Crookes, Mahalia, PIP MILLETT, Eloise"
Why Bonnie,"BABEHOVEN, Wishy, ratboy, Rui Gabriel, Peel Dream Magazine"
Photo Ops,"Highs, Avid Dancer, Teen Men, Jr. Jr., Dear Boy"
Nick Cave & the Bad Seeds,
JAY-Z,
Angus & Julia Stone,"Angus Stone, Julia Stone, Dope Lemon, Ben Howard, Fink"
Guantanamo Bay Surf Club,"Jack Symes, Marty O'Reilly & the Old Soul Orchestra, Austyn Gillette, Smooth Hound Smith, Duff Thompson"
Artie Shaw,"Benny Goodman, Glenn Miller, Tommy Dorsey, Artie Shaw and His Orchestra, Charlie Barnet"
charlie houston,"young friend, Abby Sage, Wallice, MAY-A, Maddie Jay"
Author’s Note,"Chapter 31, Chapter 38, Chapter 41, Chapter 35, Chapter 32"
Scenic Route to Alaska,"Anyway Gang, Terra Lightfoot, Modern Space, Fast Romantics, Close Talker"
Velvet Orchyd,"Ceasar Wolphano, Vin Qualiva, Martyn Cuthbert, Monkee Sez No!, Fielding Chase"
Saint Motel,"The Happy Fits, The Unlikely Candidates, I DONT KNOW HOW BUT THEY FOUND ME, Dreamers, Max Frost"
Valerie June,"Allison Russell, Rhiannon Giddens, Amythyst Kiah, Frazey Ford, Sarah Shook & the Disarmers"
Lord Huron,"Gregory Alan Isakov, The Head and the Heart, The Lumineers, Caamp, The Paper Kites"
Generationals,"sjowgren, Starfucker, Coconut Records, Ra Ra Riot, Husbands"
Cory Wong,"The Fearless Flyers, Vulfpeck, Mark Lettieri, Vulfmon, Dirty Loops"
Paul Heaton,"Paul Weller, David Gray, Will Young, Lloyd Cole, Frank Turner"
Al Menne,"Great Grandpa, ratboy, Sun June, BABEHOVEN, Mali Velasquez"
Chris Cohen,"Jon McKiel, sam evian, Peel Dream Magazine, Amen Dunes, PEARL & THE OYSTERS"
The Red Pears,"Junkie, Israel's Arcade, Jurassic Shark, Balkans, Jaded Juice Riders"
Shame Gang,"DevMaccc, Young Combo, Seth Sutch, Jooselord, Pure Hunger Entertainment"
Kicking Rocks,"Arlie & Jarren Blair, Mickey Darling & Dafna, Stunnaman02, MIA GLADSTONE & Trent the HOOLiGAN, Billy Lemos & Tati"
Avec Plaisir,"Swiss Army Wife, Excuse Me Who Are You?, Kerosene Heights, I love your lifestyle, tiny voices"
Wolf Alice,"The Big Moon, Black Honey, WET LEG, The Last Dinner Party, Yeah Yeah Yeahs"
Tove Styrke,"Dagny, Foxes, Astrid S, Say Lou Lou, Vérité"
Blossoms,"The Courteeners, The Lathums, Catfish and The Bottlemen, Sam Fender, Sea Girls"
Vera Sola,"Bill Ryder-Jones, Marika Hackman, Torres, Nadine Shah, Hurray For The Riff Raff"
Danny Brown,"JPEGMAFIA, JPEGMAFIA & Danny Brown, Death Grips, Earl Sweatshirt, Injury Reserve"
Strawberry Guy,"VACATIONS, Dream, Ivory, Current Joys, Matt Maltese, Oscar Lang"
NoSo,
Wave Chapelle,"KYYNGG, ralo, Jay idk, Shad Da God, Mike Zombie"
Killer Mike,"Run the Jewels, El-P, Big Boi, Big K.R.I.T., Scarface"
Updog,"Jake Daniels, Say So City, Paper Idol, Layto, Demi the Daredevil"
fantasy of a broken heart,"Wishy, Being Dead, Peel Dream Magazine, 2nd Grade, Sex Week"
College Try,"First Reserve, BARK Like a Dog, Park Flyers, As Silent as the Forest, There's A Tuesday"
Kanye West,"Kids See Ghosts, Jay-Z & Kanye West, ¥$, The Throne, Kendrick Lamar"
Motel Breakfast,"The Dead Bolts, Mad Lasso, Jacklen Ro, Briscoe, Wormy"
Klaus Johann Grobe,"Minami Deutsch, Beak>, Astrel K, CV Vision, Ulrika Spacek"
We are the Willows,"The Daredevil Christopher Wright, Caroline Smith And The Good Night Sleeps, Lucy Michelle and the Velvet Lapelles, Roma Di Luna, Chris Koza"
Emily Browning,"The Pierces, Jem, Amy Lee, Tommee Profitt, Alison Mosshart and Carla Azar"
Interesting Times Gang,"Nathan Gray, Elena Rud, Ben Chasny, Foul Territory, Town Liar, Dan Phelps, Matt Chamberlain & Viktor Krauss"
Baths,"Geotic, Gold Panda, Nosaj Thing, Shlohmo, How to Dress Well"
Stef Chura,"Palehound, Great Grandpa, The Courtneys, Chastity Belt, Swearin'"
"Iron & Wine, Fiona Apple","The Secret Sisters, Ray LaMontagne, Waxahatchee, MJ Lenderman, King Princess, Fiona Apple, Efterklang, Beirut, The Decemberists, James Mercer"
Eminem,"Bad Meets Evil, D12, Paul Rosenberg, Obie Trice, 50 Cent"
Bad Religion,"Pennywise, NOFX, Lagwagon, Rancid, Social Distortion"
Stan Forebee,"Kissamilé, Ian Ewing, Ben Bada Boom, Mo Anando, Psalm Trees"
The Gaslight Anthem,"The Horrible Crowes, The Menzingers, Dave Hause, The Loved Ones, Hot Water Music"
Lightwave,"Robert Rich & Steve Roach, Dilate, Steve Roach & Vir Unis, Steve Roach & Vidna Obmana, Paul Schütze"
L Devine,"Luna Shadows, Terror Jr, Carlie Hanson, Dagny, Elio"
Lynx XII,"Auðura, BBG's, Tall Towers, Louaminé, Kirabuo"
Milky Chance,"Henry And The Waiter, Broken Back, Sir Sly, Portugal. The Man, Lime Cordiale"
Marketplace,"Marketplace Tech, No Author, Make Me Smart, Marketplace Morning Report, On The Media"
yukimi,"Deep Sea Diver, Biig Piig, Carlita, IDER, Caribou"
Topaz Jones,"Phony Ppl, PawPaw Rod, Leven Kali, Duckwrth, GoldLink"
Ceres,"Slowly slowly, Foxing, Spanish Love Songs, Moose Blood, The Hotelier"
Toto,"Journey, Christopher Cross, Foreigner, Asia, Phil Collins"
Teenage Halloween,"Sincere Engineer, Signals Midwest, Antarctigo Vespucci, Liquid Mike, short fictions"
Dusty Leigh,"FJ Outlaw, Charlie Farley, Austin Tolliver, Cypress Spring, Who TF Is Justin Time?"
Migos,"Quavo, Offset, Rich The Kid, Quality Control, Young Thug"
Bliss n Eso,"Hilltop Hoods, Thundamentals, Seth Sentry, Drapht, Urthboy"
Meggo,"it's matt, Danika, Evan Wright, Berta Bigtoe, Leponds"
Tennessee Shine,"Mic Manik, Tommy Chayne, I4NI, Cypress Spring, Charlie Farley"
This Will Destroy You,"Caspian, Explosions in the Sky, If These Trees Could Talk, pg.lost, We Lost the Sea"
THE BLSSM,"laundry day, Jean Dawson, Winnetka Bowling League, The Regrettes, Teezo TouchDown"
Under The Rug,"MotherFolk, Dominurmom, Under The Rug, Ariel Posen, Bright Eyes, DOUBLECAMP"
Mariah Carey,"Janet Jackson, Whitney Houston, Toni Braxton, Brandy, Mariah Carey & Whitney Houston"
Passion Pit,"The Naked and Famous, Matt & Kim, Phoenix, Miike Snow, Starfucker"
FINNEAS,"Billie Eilish, Lizzy McAlpine, Conan Gray, Gracie Abrams, Halsey"
Southtowne Lanes,"Barely Civil, Stay Inside, The Goalie’s Anxiety at the Penalty Kick, oso oso, State Faults"
Lauren Mayberry,"CHVRCHES, Pale Waves, Katie Gavin, ela minus, Lights"
Cults,"Beach House, TV Girl, Strawberry Guy, Tennis, Princess Chelsea"
The Clash,"Sex Pistols, Joe Strummer and the Mescaleros, Ramones, Stiff Little Fingers, The Jam"
Henry Cow,"Art Bears, Magma, Fred Frith, Slapp Happy, Hatfield and the North"
Thundercat,"DOMi & JD Beck, Free Nationals, Steve Lacy, Hiatus Kaiyote, Anderson .Paak"
Autumn Rhythm,"Summer Arachnid, Native Canadians, flaming top hat, Company Calls, Ditch Effort"
Ayra Starr,"Fireboy Dml, TEms, Rema, Victony, Omah Lay"
Fleet Foxes,"Father John Misty, Grizzly Bear, Sufjan Stevens, Bon Iver, Big Thief"
Nat Vazer,"Alice Skye, Juice Webster, Jade Imagine, Sloan Peterson, Liz Stringer"
Haley Blais,"Samia, Laura Elliott, Katy Kirby, Julia Jacklin, Leith Ross"
Mud Flow,"Ghinzu, Pretty Vicious, Girls in Hawaii, Saybia, Belasco"
Webbed Wing,"Anxious, Fiddlehead, Drug Church, Militarie Gun, Soul Blind"
Sick Fucks,"Molbo, No Time, Träume, The Phlegms, Necking"
Shoreline Mafia,
Raury,"The Underachievers, EarthGang, Mick Jenkins, Flatbush ZOMBiES, Vic Mensa"
Buck 65,"Sage Francis, Deep Puddle Dynamics, Atmosphere, Homeboy Sandman, Themselves"
Minimal Schlager,"I Speak Machine, Melllo, Wet Satin, John Foxx And The Maths, Beyond The Wizards Sleeve"
Jawga Sparxxx,"Redneck Souljers, Jawga Boyz, Bottleneck, Lenny Cooper, Big Matt"
Alan Licht,"Alan Licht & Loren MazzaCane Connors, Angus MacLise, Tony Conrad, A Handful of Dust, Marina Rosenfeld"
The Killers,"Brandon Flowers, Kings of Leon, Snow Patrol, Kaiser Chiefs, Keane"
Joe Henry,"Peter Case, Patty Griffin, John Wesley Harding, Greg Brown, John Hiatt"
Good Looks,
Chapter Twenty-six,
Bhad Bhabie,"Saweetie, City Girls, Cardi B, Asian Doll, DreamDoll"
Kontar Basara,"Black Pepper, Nate Monsters, Retail Drugs, hi again, Pulsr"
Ziggy Alberts,"Ocie Elliott, Ryan Harris, Sons Of The East, Xavier Rudd, Dustin Tebbutt"
Fabiano do Nascimento,"Sam Gendel, Ancient Infinity Orchestra, Mary Halvorson, Daniel Villarreal, Greg Foat"
Sydney Sprague,"Camp Trash, kississippi, Pool Kids, Snarls, All Get Out"
Cory Hanson,"Wand, Woods, Thee Oh Sees, Meatbodies, Osees"
Dean Lewis,"Lewis Capaldi, Matt Hansen, Cian Ducrot, Anson Seabra, James Arthur"
Jacana People,"Dj Counselling, Barry Can't Swim, Tibasko, Cameo Blush, Obli"
Foster the People,"Two Door Cinema Club, Grouplove, Young the Giant, Dayglow, Broken Bells"
Twin XL,"Betcha, Magic Giant, Saint Blonde, Dreamers, Flor"
Tyler Hubbard,"Jordan Davis, Dylan Scott, Nate Smith, Bailey Zimmerman, Cole Swindell"
David Gilmour,"Roger Waters, Pink Floyd, Richard Wright, Mark Knopfler, The Alan Parsons Project"
Miranda Lambert,"Pistol Annies, Carrie Underwood, Little Big Town, Maren Morris, Lainey Wilson"
Ellie Gowers,"Filkin's Ensemble, Kitty Macfarlane, Mishra, The Magpies, Tarren"
2Pac,"Thug Life, The Notorious B.I.G., Snoop Dogg, Dr. Dre, 50 Cent"
K's Choice,"dEUS, Novastar, Bettie Serveert, Skunk Anansie, Anouk"
Lost Frequencies,"Kygo, Robin Schulz, Sam Feldt, Felix Jaehn, OFENBACH"
Luke Combs,"Morgan Wallen, Jordan Davis, Bailey Zimmerman, Cody Johnson, Riley Green"
The Cordial Sins,"Souther, Arista Fiera, fragile animals, Apartamentos Acapulco, Lasitud"
Sir,
Stellar Serenity,"Amphose, Sleepwear, Aveniós, Tuscany Flow, Leon White"
Jamie Levine,Francesca van Keeken
The Tobasco Donkeys,"Philmont 2017 Staff, Charlie's Revenge, Philmont Staff, Sally No. 1, Creatures of the Lake"
RY X,
Mother Mother,"Fish in a Birdcage, I DONT KNOW HOW BUT THEY FOUND ME, Cavetown, Tally Hall, The Hoosiers"
Jesse Welles,"Pete Seeger, Phil Ochs, Woody Guthrie, Odie Leigh, Jim Croce"
Ab-Soul,"Jay Rock, ScHoolboy Q, Black Hippy, Isaiah Rashad, Mick Jenkins"
Kylie Minogue,"Dannii Minogue, Sophie Ellis-Bextor, Madonna, Girls Aloud, Cher"
Astral Bakers,"Poppy Fusée, Lescop, JB Dunckel, Saint DX, Bertrand Belin"
Bad Bad Hats,"sjowgren, Charly Bliss, ratboy, Now, Now, Rosie Tucker"
Dote,"wildfire., Luke Noa, Cinemagraph, Chai Khat, Roast Apple"
Daryl Hall & John Oates,"Daryl Hall, Kenny Loggins, Huey Lewis & The News, Mr. Mister, The Doobie Brothers"
Backseat Dragon,"toothbrusher2000, TVOD, Sorry Snowman, Empty Nesters, Out by Lucy"
Teethe,"sundots, Unrecovery, fairies in our house, waveform*, Horse Jumper of Love"
Angie McMahon,"Middle Kids, Maple Glider, Thelma Plum, Julia Jacklin, Gang of Youths"
Drug Cabin,"Levitation Room, Mystic Braves, Dick Stusso, Babe Rainbow, Orions Belte"
Ora Cogan,"Jessica Pratt, Tiny Ruins, Bedouine, Julie Byrne, Hana Stretton"
Geowulf,"Hazel English, Yumi Zouma, Still Corners, lunar vacation, Day Wave"
Porches,"Mk.gee, Sylvan Esso, Kacy Hill, Rostam, Jessy Lanza"
Troye Sivan,"Lorde, Conan Gray, Charli XCX & Troye Sivan, Tove Lo, Charli XCX"
Laura Marling,"Jessica Pratt, The Weather Station, Cassandra Jenkins, Nilüfer Yanya, The Staves"
MARBLED EYE,
Meatbodies,"Fuzz, Wand, Thee Oh Sees, Ty Segall, Frankie and the Witch Fingers"
Cabane,"Ricardo Villalobos, Soul Capsule, Petre Inspirescu, Gui Boratto, Dimbiman"
Nation of Language,
"Ice Spice, Gunna","Ice Spice, Travis Scott, Ice Spice, Central Cee, ICE SPICE, Ice Spice, Anuel AA, Cash Cobain, Ice Spice, Bay Swag"
Public Enemy,"Boogie Down Productions, Eric B. & Rakim, EPMD, Run-D.M.C., LL Cool J"
Katy Goodman,"Katy Goodman & Greta Morgan, Elk City, Kayleigh Goldsworthy, Annie Eve, The Chapin Sisters"
Light Lead,"Teleforme, Atomic Fruit, Secret Cameras, Frank Cervantes, Marry Cherry"
Kirabuo,"Fluvis, Louaminé, BBG's, Tall Towers, Auðura"
ALEXSUCKS,"Wilderado, Brigitte Calls Me Baby, hey, nothing, White Reaper, Colony House"
Jack Kays,"kennyhoopla, Sueco, Games We Play, KennyHoopla & Travis Barker, jxdn"
Girl Scout,"Francis of Delirium, Coach Party, Fake Fruit, Heartworms, Moreish Idols"
The Script,"OneRepublic, The Fray, Train, Maroon 5, Parachute"
Phoenix,"Passion Pit, Vampire Weekend, Two Door Cinema Club, Cut Copy, Foster the People"
The Get Up Kids,"The Promise Ring, Saves the Day, Braid, The New Amsterdams, The Anniversary"
Ren,"NF, Connor Price, Nic d, Sam Tompkins, Katie"
Yuno,"sjowgren, Goth Babe, Sure Sure, Husbands, Mormor"
Kevin Morby,"Damien Jurado, Woods, Kurt Vile, Aldous Harding, M. Ward"
"Mandy, Indiana","Model/Actriz, Gilla Band, Sweeping Promises, Special Interest, Stuck"
dodie,"Orla Gartland, Fizz, Chloe Moriondo, Tessa Violet, Cavetown"
From Nowhere Wil,
Sade,"Erykah Badu, Sweetback, Solange, Anita Baker, Amy Winehouse"
The Wilder Blue,"Shane Smith & the Saints, Jason Eady, Mike and the Moonpies, Colby Acuff, Turnpike Troubadours"
Run the Jewels,"El-P, Killer Mike, Aesop Rock, Danny Brown, Hail Mary Mallon"
Nathan Dies,"Salma e Mac, Sreya, A Balsa, Antônio Neves, Trago"
CeeLo Green,"Gnarls Barkley, Maverick Sabre, John Legend, Jordan Mackampa, Macy Gray"
Humbird,"Anna Tivel, Joshua Burnside, the brother brothers, Darlingside, Chris Staples"
The Fourth Wall,"Friko, alexalone, Punchlove, Wednesday, Swervedriver"
The Bacao Rhythm & Steel Band,"El Michels Affair, The New Mastersounds, Menahan Street Band, Polyrhythmics, The Budos Band"
Frankie Cosmos,"Free Cake For Every Creature, Florist, Girlpool, WHATEVER, DAD, adult mom"
Compulsive Gamblers,"Reigning Sound, Oblivians, Lost Sounds, Reatards, The Gories"
Christopher Rountree,"Gabriela Ortiz, Missy Mazzoli, Peter One, Deerlady, June Jones"
Fruit Bats,"Blitzen Trapper, Vetiver, Houndmouth, Deer Tick, Dr. Dog"
Molchat Doma,"Nürnberg, Vollny, PLOHO, CHERNIKOVSKAYA HATA, The End of Electronics"
Saltyyyy V,"Lætitia, Jr. Wellness, Drama Hights, Apfel Gee, Richie Rych"
Model Home,"---__--___, Blackhaine, Mas Aya, Greg Fox, Scotch Rolex"
The Beach Boys,"Brian Wilson, Dennis Wilson, Van Dyke Parks, Jan & Dean, The Monkees"
Scam Likely,"Social Cig, BUG MOMENT, Diet Lite, Doubter, Shoobie"
Tiny Habits,"Lizzy McAlpine, Alix Page, Jensen McRae, Tommy Lefroy, Cece Coakley"
UGK,"Pimp C, 8Ball & MJG, Bun B, Fat Pat, Scarface"
Elijah Johnston,"Well Kept, Heffner, Sun Casino, Lighthearted, The Braymores"
Florence + the Machine,"Hozier, Lorde, Marina & the Diamonds, Marina, HAIM"
Gracie Gray,"juliet sunflower, Wilma Laverne Miner, Baerd, ash tuesday, career woman"
Butterfly Boucher,"Kate Havnevik, Katie Herzig, Ingrid Michaelson, Anna Nalick, A Fine Frenzy"
Night Riots,"Smallpools, Vinyl Theatre, Finish Ticket, Flor, 888"
Maria Chiara Argirò,"Maria Chiara Argiró, Shabaka, Saya Gray, Kelly Moran, Jasmine Myra"
Terminally Phil,"Drew Beskin, Elijah Johnston, Tedo Stone, Heffner, The Pink Stones"
Rapsody,"Nxworries, Phonte, Che Noir, Black Thought, Lupe Fiasco"
a-ha,"Morten Harket, Alphaville, Duran Duran, Tears for Fears, Erasure"
BEHM,"Ellinoora, Evelina, Olavi Uusivirta, Viivi, Haloo Helsinki!"
Silverbacks,"Do Nothing, Folly Group, Fake Fruit, The Cool Greenhouse, Bodega"
Catherine Howe,"Kevin Vicalvi, Elyse Weinberg, Becky Severson, Rosalie Sorrels, Ruthann Friedman"
Sing Street,"The Dream Academy, The Knack, Keira Knightley, Adam Levine, V, Cautious Clay"
Aves,"Kissamilé, Rose Noir, Masked Man, Mac Kay, Enough Cereals"
Annie DiRusso,"Venus & the Flytraps, Samia, Tommy Lefroy, Laura Elliott, Blondshell"
Bug Bath,"Tummyᐩ, Slash fiction, Wrong Man, Tooth Cemetery, Charity Kiss"
"Ice Spice, Central Cee","Ice Spice, Gunna, Ice Spice, Travis Scott, Central Cee, Lil Baby, LeoStayTrill, Mr Reload It, Sexyy Red, Drake"
Orange Juice,"Josef K, Aztec Camera, The Monochrome Set, The Teardrop Explodes, Felt"
Damon Locks,"Irreversible Entanglements, Carlos Niño, Tomin, Anna Butterss, High Pulp"
Eliza & The Delusionals,"Tia Gostelow, Middle Kids, Phoebe Go, Teenage Joans, Now, Now"
"Chicago Stadium: July 12, 1979","Then and Now: 1979–Present, Aurora World Tour: 1978–1979, The Rise of the Six: 1966–1972, Aurora: 1977–1978, Seven Eight Nine: 1975–1976"
Conor Oberst,"Bright Eyes, Conor Oberst and the Mystic Valley Band, Desaparecidos, Monsters of Folk, Better Oblivion Community Center"
Charli xcx,
Gracie Abrams,"Alessi Rose, Lizzy McAlpine, Sabrina Carpenter, Maisie Peters, Olivia Rodrigo"
Wes Swing,"Cole Scheifele, Jon Middleton, Logan Bowden, Dan Griffin, Kieran Campbell"
Hank Midnight,"Karima Walker, Carm, Duffy x Uhlmann, Ryland Bouchard, Layten Kramer"
Elis Noa,"Kuoko, Childe, Maria Basel, Varley, Mynth"
Julius Rodriguez,"Nduduzo Makhathini, oreglo, Oded Tzur, Joey Alexander, Blue Lab Beats"
Bridget Kearney,"Taylor Ashton, Elizabeth Moen, Wormy, Dead Gowns, Laura Jean Anderson"
Hayley Williams,"Paramore, PVRIS, Elke, Florence + the Machine, Tonight Alive"
Skyway Man,"Modern Nature, Anna St. Louis, Katy Kirby, Andy Shauf, Maple Glider"
Sleepy Cow,"Edy Ocean, AMSpace, David Struck, Pure Sleeping Vibes, Thibaut Lozé"
Atoms for Peace,"Thom Yorke, Radiohead, EOB, Jonny Greenwood, Ultraísta"
Ty Segall,"Ty Segall & White Fence, Ty Segall Band, Thee Oh Sees, Fuzz, Meatbodies"
Cast,"Ocean Colour Scene, Dodgy, Shed Seven, The Bluetones, The Seahorses"
Ruby Fields,"Tired Lion, Spacey Jane, Beddy Rays, Ball Park Music, WaaX"
The Velvet Underground,"Lou Reed, The Stooges, John Cale, Bob Dylan, Television"
¥$,"Kanye West, Metro Boomin, Kids See Ghosts, JackBoys, 21 Savage"
Ratboys,
Kate Bush,"Björk, Fiona Apple, Tori Amos, PJ Harvey, Joni Mitchell"
Cousin Stizz,"Maxo Kream, Buddy, Dom Kennedy, Guapdad 4000, Malz Monday"
Keystone State Boys Choir,"Nicholas Cloud, Kameron Greene, Casual Sex, Adriel, 8RO8"
JD McPherson,"John Lindberg Trio, The Hillbilly Moon Explosion, The Brian Setzer Orchestra, Wanda Jackson, Imelda May"
Steve Stout,"Astrachan, Dream Sitch, Long Island Railroad, Magic Al, Daniel Mudliar"
Stay Inside,"Barely Civil, Carpool, Gulfer, awakebutstillinbed, oso oso"
Moonchild Sanelly,"Anna Erhard, Zzzahara, Self Esteem, Sad Night Dynamite, Katy J Pearson"
Eddie Vedder,"Pearl Jam, Chris Cornell, Temple of the Dog, Mad Season, Glen Hansard"
Why?,"Hymie's Basement, cLOUDDEAD, 13 & God, Subtle, Themselves"
The Beths,"Illuminati Hotties, ratboy, Remember Sports, Courtney Barnett, Charly Bliss"
New York Herald Tribune,"Les Quatre Cents Coups, Song For Our Ancestors, Franсoise Hardy, Motel Breakfast, Thomas Flynn"
Real Estate,"Martin Courtney, Beach Fossils, Ducktails, Wild Nothing, Kurt Vile"
Spaceport,"Setrise, Woody Van Eyden & Alex M.O.R.P.H. feat. Michelle Citrin, Abbott & Chambers, Kiwi Project, Terry Ferminal"
Matthew Logan Vasquez,"Actual Wolf, The Texas Gentlemen, Quiet Hollers, The Yawpers, Paul & The Tall Trees"
The Milk Carton Kids,"Watchhouse, Gregory Alan Isakov, Birdtalker, Josh Ritter, The Ballroom Thieves"
The Burkharts,"The Daughters of Eve, The wonders, The Little Dippers, The Polar Boys, Bobby Vinton"
Basia Bulat,"Laura Gibson, Laura Veirs, Feist, Great Lake Swimmers, This Is the Kit"
L'Impératrice,"Bleu Toucan, The Parcels, Lewis OfMan, MIEL DE MONTAGNE, Polo & Pan"
Christian Sparacio,"harf., Dom Louis, Welcome Stranger, Ethansroom, Dipsea Flower"
St. Lunatics,"Ali & Gipp, Lil' Zane, 504 Boyz, Drag-On, Da Band"
Betty Who,"Dagny, Léon, Fickle Friends, Foxes, Bonnie McKee"
Fat White Family,"Warmduscher, Snapped Ankles, The Lovely Eggs, Ty Segall, The Limiñanas"
The Head and the Heart,"Caamp, The Lumineers, Gregory Alan Isakov, Mt. Joy, Blind Pilot"
Summer Salt,"mellow fellow, Small Forward, boy pablo, Peach Pit, no vacation"
Luther Vandross,"Freddie Jackson, Anita Baker, Teddy Pendergrass, Babyface, Atlantic Starr"
Amyl and the Sniffers,"Lambrini Girls, The Chats, Stiff Richards, Teen Mortgage, Wine Lips"
ok jolson,"Aubvrn, Teana, IF Igor Falecki, Larez, Spun Mellow"
Delaney Bailey,"searows, Leith Ross, runo plum, Lizzy McAlpine, Tommy Lefroy"
Oliver Tank,"Kyson, Mammals, Låpsley, Stumbleine, Chet Faker"
Bebe Stockwell,"harf., Sidney Bird, Oscar Blue, HAFFWAY, Mikayla Pasterfield"
Orange 9mm,"Helmet, Quicksand, Burn, Into Another, Snapcase"
Will Stratton,"Sam Pinkerton, Hip Hatchet, Dave Gerard & The Watchmen, Christopher Paul Stelling, Ferraby Lionheart"
Ol' Dirty Bastard,"Method Man, Ghostface Killah, Raekwon, Wu-Tang Clan, GZA/Genius"
Liquid Mike,"Camp Trash, Dazy, good looks, Wild Pink, Superviolet"
Fax Gang,"Rat Jesu, $PIRIT GURLZ, 999 Heartake Sabileye, AERO GROS M, meat computer"
Oranje,"Still Depths, Jed Arbour, Real friend, Bennett Mitchell, Alec Arms"
Royal Smith,
Super Defense,"richie woods, Karma Wears White Ties, Aldo Fisk, Slumbers, Name The Band"
Cult of Luna,"Rosetta, Isis, The Ocean, Neurosis, Amenra"
Chapter Fourteen,"Chapter Thirteen, Chapter Fifteen, Chapter Sixteen, Chapter Seventeen, Chapter Twelve"
Pearl and the Beard,"Jeremy Styles, Jocelyn Mackenzie, Casey Shea, Caroline Smith And The Good Night Sleeps, David Wax Museum"
ETTA MARCUS,"Sarah Kinsley, Abby Sage, Tommy Lefroy, Kristiane, Susannah Joffe"
Half Waif,"Torres, Flock of Dimes, Why Bonnie, Miya Folick, Trace Mountains"
villagerrr,"Oldstar, MJ Lenderman, Hovvdy, A Country Western, Bloomsday"
Francis of Delirium,"Lime Garden, Pillow Queens, Girl and Girl, Blondshell, Girl Scout"
Soot Sprite,"Regal Cheer, Toodles & The Hectic Pity, Suds, cheerbleederz, Charmpit"
Yellow Ostrich,"The Dodos, Bombadil, Bowerbirds, Someone Still Loves You Boris Yeltsin, Man Man"
Isaiah Rashad,"Smino, Saba, ScHoolboy Q, Mick Jenkins, Joey Bada$$"
Víolet Dawn,"Francis Flo, Barkérby, Skeru, Harry Bloom, Mimber"
The Von Tramps,"Something to Do, Be Like Max, Backyard Superheroes, J Navarro & the Traitors, Hans Gruber And The Die Hards"
Danger Dan,"Antilopen Gang, Kummer, Fatoni, Alligatoah, Käptn Peng"
Dignan Porch,"Kids On A Crime Spree, Dead Gaze, Hanoi Janes, The Mantles, Burnt Ones"
Katy Kirby,"Lomelda, squirrel flower, Rosie Tucker, Torres, Tomberlin"
Janelle Monáe,"Solange, Victoria Monét, amaarae, Jazmine Sullivan, Jessie Ware"
Rad Museum,"Tabber, DEAN, Colde, DPR LIVE, Mokyo"
Lunar Vacation,
Charles Walker,"Mountain Time, Liz Cooper & The Stampede, Sam Skinner, Derek Ted, Hodera"
Miri,"Sudden Weather Change, Reykjavik!, Markús & The Diversion Sessions, For a Minor Reflection, Zach & Foes"
Cold War Kids,"Young the Giant, Grouplove, Atlas Genius, Portugal. The Man, Spoon"
Aspen Forest,"Indie Anthony, EVNTYD, JW Francis, EKKSTACY, Sinnerella"
Hermanos Gutiérrez,"Arc De Soleil, LA LOM, BALTHVS, Los Bitchos, Emapea"
Tiera Kennedy,"Reyna Roberts, Brittney Spencer, Mickey Guyton, Tanner Adell, Kassi Ashton"
Kneecap,"The Mary Wallopers, The Wolfe Tones, Gurriers, Fat Dog, The Rubberbandits"
Lukas Nelson,"Randy Rogers, Kat Hasty, Morgane Stapleton, Waylon Malloy Payne, Croy and the Boys"
Teezo Touchdown,
Addison Rae,"Charli XCX & Troye Sivan, Camila Cabello, Heidi Montag, Kim Petras, Tate McRae"
Billie Marten,"Lucy Rose, Fenne Lily, Bess Atwell, Matilda Mann, searows"
Greg Mendez,"Superviolet, MJ Lenderman, Allegra Krieger, Wednesday, Lomelda"
Erika de Casier,"Kelela, Rochelle Jordan, George Riley, amaarae, Oklou"
Beyond 5,"McKenna Hixson, Nik Day, Elenyi, Dan Kartchner, Rowan Taylor"
Blu,"Blu & Exile, Elzhi, Fashawn, Roc Marciano, Little Brother"
Denzel Curry,"Jid, Denzel Curry & Kenny Beats, Joey Bada$$, JPEGMAFIA, Vince Staples"
The Jammin Kid,"Ekland Hasa, E-lie, Ryan skyy, Micah McLaurin, Pure Shores"
Laura Brown Roselle,
Uranium Club,"Erik Nervous, R.M.F.C., Marbled Eye, Gee Tee, Powerplant"
Nick Shoulders,"Sierra Ferrell, Vincent Neil Emerson, Willi Carlisle, Bella White, John R. Miller"
Bachman-Turner Overdrive,"Foghat, The Guess Who, April Wine, Joe Walsh, Bad Company"
The Marías,"Clairo, Men I Trust, beabadoobee, Tokyo Tea Room, Shelly"
Craig Mack,"Erick Sermon, Das EFX, Smif-n-Wessun, Lost Boyz, Keith Murray"
Jeffrey Silverstein,"Golden Brown, William Tyler, North Americans, Steve Gunn, Anna St. Louis"
Subtle Orange,"Sun Casino, Saint Luna, 2%, West 22nD, Ray and Paul Holmberg"
HONNE,
Chrysalism,"The Lost & Found Workshop, Divorce Court, Jayomi, Takotsubo, The Macrobats"
