Artist,Similar Artists
Colored Lights,"Soft Covers, The Boys with the Perpetual Nervousness, The Lost Days, The Laughing Chimes, The Radio Field"
The Last Dinner Party,"Wolf Alice, WET LEG, The Beaches, Lucy Dacus, Florence + the Machine"
Chapter Five,"Chapter 6, Chapter 4, Chapter 3, Chapter 9, Chapter 7"
mxmtoon,"Chloe Moriondo, Cavetown, dodie, Lyn Lapid, Frances Forever"
Leaving Time,"Trauma Ray, All Under Heaven, GLARE, Soul Blind, Sleepwalk"
Emily Yacina,"Skirts, Free Cake For Every Creature, Long Beard, Alex G, Frankie Cosmos"
Nightwlks,"Henry Cron, Wilbur Swain, OGMH, Darling Coils, SACRÉ BLEU!"
Michigander,"Wilderado, Joe P, Krooked Kings, GRMLN, Your Neighbors"
"Earth, Wind & Fire","Kool & The Gang, Brothers Johnson, Ohio Players, Chic, Commodores"
The Hotelier,"Foxing, The World Is a Beautiful Place & I Am No Longer Afraid to Die, oso oso, Free Throw, Joyce Manor"
DJ Green Lantern,"Gostfase, M. Shinoda and Lupe Fiasco, Re-Up Gang, Hell Rell, Nucci Reyo, Grafh"
The Armed,"Genghis Tron, Pupil Slicer, KEN mode, The Callous Daoboys, Botch"
Mishegas,"Bay Ledges, Henry Green, The Lagoons, Plastic Picnic, St. South"
"One Last Thing Before I Go: November 5, 2012",
Flyte,"Junodream, Island, Bess Atwell, Billie Marten, Black Sea Dahu"
Humbear,"Okay Mann, Chappy, J.B. Boone, James Spaite, Harbor & Home"
A Swarm of the Sun,"Oh Hiroshima, Pijn, Latitudes, Spurv, Sleepmakeswaves"
Ellie Jackson,"Scam Likely, Caley Conway, Abby Jeanne, The Deer, Bridget Kearney"
Lightning Books,"Olddirtygeorge, Sean Martin West, Nikas, Norman Lake, Benji Tranter"
Neon Trees,"Walk the Moon, The Mowgli's, American Authors, Bad Suns, New Politics"
Sylvan Esso,"Lucius, Mr. Little Jeans, Miike Snow, Generationals, Phantogram"
Aby Coulibaly,"PIP MILLETT, Elmiene, Äyanna, Ambré, Olivia Dean"
Helado Negro,"Blue Lake, Amen Dunes, astrid sonne, Torres, Devendra Banhart"
Valebol,"Verity Den, LAKE J, sam evian, The Green Child, Alena Spanger"
Shania Twain,"Faith Hill, LeAnn Rimes, Jo Dee Messina, Carrie Underwood, Martina McBride"
Mazzy Star,"Hope Sandoval & The Warm Inventions, Mojave 3, The Sundays, Cocteau Twins, Fiona Apple"
Kate Nash,"Lily Allen, Regina Spektor, A Fine Frenzy, KT Tunstall, Tegan and Sara"
Never Ending Fall,"The Never Ending Fall, Talking Points, Noshows, More&More, Cousin Simple"
Nadia Reid,"Aldous Harding, Heather Woods Broderick, This Is the Kit, Tiny Ruins, Marlon Williams"
Siames,"Mystery Skulls, Paper Idol, Siamés, Saint Motel, Younger Hunger"
Max García Conover,"Kieran Campbell, Peter Doran, Mary Elizabeth Remington, Keenan O'Meara, Abby Webster"
Sleigh Bells,"Santigold, Purity Ring, Yeah Yeah Yeahs, Black Dresses, M.I.A."
Latto,"Megan Thee Stallion, Glorilla, JT, Cardi B, Monaleo"
Diet Cig,"Remember Sports, Girlpool, Cayetana, Swearin', Charly Bliss"
Griff Beynon,"Alegro Moya, Zamphire, Lyla Perez-Vega, Don Mazuck, Asa Kora"
VanWyck,"Opera Alaska, Sam & Julia, Vreemde Kostgangers, Clean Pete, JW Roy"
JKing,"Fejoint, dj noiz, Victor J Sefo, Lomez Brown, SPAWNBREEZIE"
Billy Strings,"Greensky Bluegrass, Kitchen Dwellers, Leftover Salmon, Daniel Donato, The Infamous Stringdusters"
Jack White,"The White Stripes, The Raconteurs, The Dead Weather, The Black Keys, Dan Auerbach"
Leyla McCalla,"Our Native Daughters, Hurray For The Riff Raff, Rhiannon Giddens, Kaia Kater, Mélissa Laveaux"
Waxahatchee,"Rosali, Jess Williamson, Cassandra Jenkins, Jessica Pratt, ratboy"
BigXthaPlug,"That Mexican OT, WacoTron, Big Yavo, Big Scarr, Key Glock"
Speedrun,"Japè Tucciné, Sofia D'Angelo, Visiun, 24thankyou, Melody English"
Powers,"Max Frost, Two Another, John Splithoff, Capital Cities, Jubël"
Rae Sremmurd,"Migos, Swae Lee, Rich The Kid, Fetty Wap, French Montana"
Noah and the Whale,"Slow Club, Edward Sharpe & The Magnetic Zeros, Mumford & Sons, Stornoway, Johnny Flynn"
My Morning Jacket,"Monsters of Folk, Wilco, Band of Horses, The War on Drugs, Fruit Bats"
Throwing Snow,"Koreless, Dark Sky, Weval, iTAL tEK, Djrum"
yeule,
Beth Gibbons,"Beth Gibbons & Rustin Man, Portishead, Laura Marling, Jessica Pratt, Nilüfer Yanya"
The Good Life,"Tim Kasher, Cursive, Bright Eyes, Conor Oberst, Desaparecidos"
Stan Getz,"Paul Desmond, Antônio Carlos Jobim, Stan Getz & Charlie Byrd, Coleman Hawkins, Ben Webster"
Antônio Neves,"Ricardo Richaid, Thiago França, Jennifer Souza, Quartabê, Jonathan Ferr"
Oisin Leech,"Itasca, Bonny Light Horseman, Bill MacKay, shana cleveland, James Elkington"
Broken Social Scene,"Kevin Drew, Stars, Wolf Parade, Yo La Tengo, Deerhunter"
Doechii,"SZA, FLO, Ravyn Lenae, Megan Thee Stallion, Glorilla"
Anycia,"Karrahbooo, Anycia & Karrahbooo, TiaCorine, Latto, Monaleo"
Ohtis,"Daughter of Swords, cicada rhythm, Maja Lena, Austyn Gillette, String Machine"
G Mills,"Sebastian Kamae, Blue Wednesday, Flovry, drkmnd, dryhope"
The Deslondes,"Silverada, Melissa Carper, James McMurtry, Drayton Farley, The Felice Brothers"
Golden Everything,"Leon Majcen, Andy Sydow, Another Glory, Will Stewart, Thomas Csorba"
Futurebirds,"Johnny Blue Skies, ian noe, Deer Tick, The Cactus Blossoms, American Aquarium"
The Nude Party,"The Murlocs, Natural Child, Levitation Room, Mystic Braves, Ron Gallo"
Chapter Thirty,"Chapter Thirty-One, Chapter Thirty-Two, CHAPTER THIRTY-FOUR, Chapter Twenty-Nine, Chapter Twenty-Seven"
Leon Bridges,"Khruangbin & Leon Bridges, The teskey brothers, Michael Kiwanuka, Son Little, Black Pumas"
Stephen Moore,"Steve the Trailplayer, Charlie White, Michel Bouwmans, Justin Brisco, Dylan Bishop"
Childish Gambino,"Tyler, the Creator, Vince Staples, Chance the Rapper, Kendrick Lamar, ScHoolboy Q"
The World Is a Beautiful Place & I Am No Longer Afraid to Die,"The Hotelier, Empire! Empire! (I Was a Lonely Estate), Foxing, Deer Leap, Everyone Everywhere"
Drake,"DJ Khaled, Drake & Future, PARTYNEXTDOOR, Bryson Tiller, Tory Lanez"
John McEntire,"American Football, Yvette Young, Novo Amor & Lowswimmer, M.A.G.S., girl ultra"
"Victoria Monét, Lucky Daye","Victoria Monét, Buju Banton, Victoria Monét, Earth, Wind & Fire, Hazel Monét, Victoria Monét, Khalid, SG Lewis, Victoria Monét, Victoria Monét, Bryson Tiller"
Jenny Hval,"Lost Girls, Julia Holter, Cate le Bon, Perfume Genius, Holly Herndon"
Marc Anthony,"Gilberto Santa Rosa, Victor Manuelle, Jerry Rivera, Víctor Manuelle, Grupo Niche"
Basti,"Beron, INTRUZ, Juras, Bezczel, Lukasyno"
Beach House,"Alvvays, Melody's Echo Chamber, Slowdive, Castlebeat, The Radio Dept."
The Local Honeys,"Senora May, Two Runner, Chris Acker, Matt Heckler, Pat Reedy"
The Cure,"Siouxsie and the Banshees, Bauhaus, Joy Division, Echo & the Bunnymen, The Glove"
Donnie Dynamite,"Ryan Robert Jones, ANCODE, Cale Hawkins, Forwardman, Matthew Goodman"
@,
Benoit,"Ghostlimb, Lewd Acts, Swamp Thing, Deadhead, Sabertooth Zombie"
Chapter Two,"Chapter Three, Chapter Four, Chapter Six, Chapter Seven, Chapter Eight"
David Guetta,"Calvin Harris, Martin Garrix, Jax Jones, Robin Schulz, Tiësto"
Myles Smith,"Mark Ambor, Michael Marcagi, Chance Peña, Darren Kiely, Caleb Hearn"
The Mamas & the Papas,"The Lovin' Spoonful, Cass Elliot, The Turtles, Donovan, The Zombies"
Pusha T,"Clipse, ScHoolboy Q, Kids See Ghosts, Jay-Z, Jay-Z & Kanye West"
Saint Etienne,"Annie, Dubstar, Everything But the Girl, Pet Shop Boys, Tracey Thorn"
The Japanese House,"Muna, Samia, Maggie Rogers, Holly Humberstone, Claud"
Shelly,"Clairo, beabadoobee, The Marías, The Sundays, lunar vacation"
Bob Junior,"Benja, tomy wyne, Outside Air, Judah Just Kidding, Bo Milli"
Tiny Ghosts,"thee nine, Asiatics, Await, Mayers Hoforchester, Rachel Mintz"
"Rapsody, Hit-Boy","Rapsody, Phylicia Rashad, Rapsody, DIXSON, Rapsody, Bee-B, Rapsody, Lil Wayne, Niko Brim, Rapsody, Erykah Badu"
Varsity,"Tennis, Voxtrot, no vacation, Hot Flash Heat Wave, Alvvays"
Annie Hamilton,"Middle Kids, San Cisco, Teen Jesus and the Jean Teasers, Camp Cope, Phantastic Ferniture"
Ricky Jamaraz,"Los Campesinos!, Johnny Foreigner, Bears In Trees, Phoneboy, LoveJoy"
Tracy Chapman,"Indigo Girls, Eva Cassidy, Natalie Merchant, Jennifer Warnes, Shawn Colvin"
50 Cent,"G-Unit, Lloyd Banks, Obie Trice, The Game, Tony Yayo"
Lil Wayne,"Birdman & Lil' Wayne, Birdman, 2 Chainz, Young Jeezy, T.I."
Riot Stares,"excide, Almighty Watching, Eternal Sleep, Point of Contact, Blood Runs Cold"
Covey,"Adjust the Sails, Blue Foster, Have Mercy, MotherFolk, Wilbur Soot"
Dinah Washington,"Sarah Vaughan, Carmen McRae, Anita O'Day, Etta Jones, Billie Holiday"
Jana Mila,"Danny Vera, Gillian Welch & David Rawlings, The Deslondes, Emily Wurramara, Gillian Welch"
Wild Heart Club,"prettything, astroturf, beauty sleep, Bailey Talamasina, New TV"
Rhineland,"Cole Loomis, Twin Tacoma, Retro City, The Neighborly, Francis Moon"
Twin Peaks,"together PANGEA, Wavves, The Orwells, Whitney, White Denim"
DANGERDOOM,"JJ DOOM, Viktor Vaughn, King Geedorah, MF DOOM, Czarface"
Peach Fuzz,"RAFFAELLA, Samia, lunar vacation, Tommy Lefroy, Hippo Campus"
Into It. Over It.,"Their / They're / There, Pet Symmetry, You Blew It!, Owen, Everyone Everywhere"
The Toy Dolls,"Cock Sparrer, Sham 69, UK Subs, The Adicts, Angelic Upstarts"
Rui Gabriel,"Why Bonnie, Queen of Jeans, Wishy, Quivers, This is Lorelei"
Oceanator,"Bad Moves, good looks, Teenage Halloween, Bartees Strange, Illuminati Hotties"
The Romantics,"The Knack, Tommy Tutone, Cutting Crew, Corey Hart, The Fixx"
Stevie Wonder,"Marvin Gaye, The Isley Brothers, Earth, Wind & Fire, Prince, Donny Hathaway"
LAZER DIM 700,"Glokk40Spaz, OsamaSon, 2Sdxrt3all, wildkarduno, 1oneam"
Fugazi,"Unwound, Rites of Spring, Minutemen, Drive Like Jehu, Squirrel Bait"
The Vaccines,"Spector, The Courteeners, Miles Kane, The Wombats, Sea Girls"
KONECS,"Fejoint, Jay Samson, dj noiz, Bina Butta, BLKB3RY"
David Kilgour,"3Ds, The Clean, The Chills, Bailter Space, The Verlaines"
Ada Lea,"Sadurn, Nilüfer Yanya, Merce Lemon, Indigo De Souza, ian sweet"
Laryssa Kim,"Montañera, Amor Muere, Lisel, Alena Spanger, Slowspin"
Robyn,"Röyksopp & Robyn, Robyn & La Bagatelle Magique, Róisín Murphy, Kylie Minogue, Carly Rae Jepsen"
Hamish Hawk,"King Creosote, 86TVs, Orlando Weeks, Arab Strap, Brigitte Calls Me Baby"
LP,"Bishop Briggs, X Ambassadors, Birdy, Sia, Amy Macdonald"
Tunde Olaniran,"ida'ye, Saint Mela, Jaewynn, Mahawam, Nyota Parker"
Martin Sexton,"Greg Brown, Amos Lee, Colin Hay, Brett Dennen, Ray LaMontagne"
Rachel Sermanni,"Josienne Clarke, King Creosote, Lisa Hannigan, This Is the Kit, The Staves"
Sunset Rubdown,"Wolf Parade, Moonface, Swan Lake, Frog Eyes, Handsome Furs"
Kim Gordon,"Sonic Youth, still house plants, Mannequin Pussy, Thurston Moore, Moor Mother"
Mary J. Blige,"Faith Evans, Monica, Toni Braxton, Kelly Price, Xscape"
Monica Martin,
Bonnie Prince Billy,"Palace Music, Will Oldham, Palace Brothers, Bill Callahan, Smog"
Chapter Thirty-eight,
Donna Summer,"Diana Ross, Gloria Gaynor, Janet Jackson, The Pointer Sisters, Amii Stewart"
Barry Louis Polisar,"Mateo Messina, Antsy Pants, Kimya Dawson, The Moldy Peaches, Michael Cera"
Japandroids,"Cloud Nothings, Titus Andronicus, The Hold Steady, Cymbals Eat Guitars, No Age"
Penny and Sparrow,"Gregory Alan Isakov, Drew Holcomb & the Neighbors, The Lone Bellow, Nathaniel Rateliff, Beta Radio"
Philanthrope,"leavv, Delayde, Psalm Trees, Ambulo, SWØRN"
Amelia Maxwell,"Northey, star puppet, SunnSetter, Chelsea King, Cootie Catcher"
Caroline Kingsbury,"Moody Joody, Bel, Katie Gavin, Remi Wolf, Muna"
King Hannah,"Loma, Arab Strap, Honeyglaze, Porridge Radio, Kim Deal"
Alison Moyet,"Yazoo, Paul Young, T'Pau, Annie Lennox, Erasure"
Charlie Parr,"Possessed By Paul James, Scott H. Biram, Willie Watson, John R. Miller, Hackensaw Boys"
Shamir,"Georgia, Jamila Woods, Jessy Lanza, Yaeji, Dawn Richard"
Jungle,"Franc Moody, Neil Frances, Darius, FKJ, Khruangbin"
Sharp Pins,"2nd Grade, This is Lorelei, Dwaal Troupe, Fake Fruit, Quivers"
Airpark,"Brother Moses, DD WALKER, Jonathan Something, Young in the City, RHNO"
Of Monsters and Men,"Nanna, Mumford & Sons, Vance Joy, The Lumineers, The Head and the Heart"
Adwaith,"Buzzard Buzzard Buzzard, Melin Melyn, Gorky's Zygotic Mynci, Gruff Rhys, Super Furry Animals"
Vickie Maris,"DT Jacobs, Jules Keani, Fatal Vision, Logan Alexandra, Cabela and Schmitt"
Caley Conway,"Buena cara, Holy Pinto, BUG MOMENT, Long Mama, Scam Likely"
The Game,"Lloyd Banks, Young Buck, G-Unit, T.I., 50 Cent"
Cherry Poppin' Daddies,"Big Bad Voodoo Daddy, Squirrel Nut Zippers, Royal Crown Revue, Atomic Fireballs, The Speakeasies' Swing Band!"
Fight Dice,"Drug Church, UV-TV, Mugger, Her Head's On Fire, Meat Wave"
Oracle Sisters,"Kate Bollinger, Papooz, Brad stank, okaywill, sam evian"
Asake,"Young Jonn, Olamide, BNXN, Davido, Shallipopi"
Max Diaz,"Petite League, mellow fellow, kurffew, late night drive home, IAmTheCoffin."
"Crosby, Stills, Nash & Young","Crosby, Stills & Nash, Stephen Stills, Neil Young, Buffalo Springfield, David Crosby"
Madeline the Person,
Eloise,"Bruno Major, Charlie Burg, Maya Delilah, Easha, Micah Edwards"
Brandi Carlile,"Indigo Girls, Amanda Shires, The Secret Sisters, Sara Bareilles, Allison Russell"
Samuel Nicholson,"Saloon Dion, Peli Gene, Chinless Wonder, Möscow çlub, Steve Stout"
Young Jesus,"Wild Pink, good looks, Rosali, Liquid Mike, Cloud Nothings"
Dylan Bishop,"Charlie White, six string servant, Stephen Moore, BeetRootJam, Phil Earhart"
HOMESHAKE,
Gustaf,"Bodega, Folly Group, Drahla, Cola, Yard Act"
Rats On Rafts,"The Homesick, Nouveau Velo, Bombay Show Pig, Nouveau Vélo, Anne Soldaat"
Surf Curse,"Current Joys, Beach Goons, The Frights, Yot Club, Vundabar"
Sunshy,"Precocious Neophyte, Flesh Tape, Glaring Orchid, Cigarettes for Breakfast, Glazyhaze"
Barkérby,"Víolet Dawn, Skeru, Francis Flo, Mimber, Harry Bloom"
Empty Heaven,"dba James, Hovvdy, Good Looking Friends, King of Heck, The Long Winters"
Toro y Moi,"Les Sins, Neon Indian, Washed Out, Unknown Mortal Orchestra, George Clanton"
The Rabbitts,"Hot Left Pole, Pina Palau, juliet sunflower, Logan Bowden, Dead Gowns"
Okay Omen,"Garden Home, Social Caterpillar, Endswell, BUG MOMENT, RIOTNINE"
Jodi,"Hovvdy, Al Menne, BABEHOVEN, Sun June, Stephen Steinbrink"
Shabaka,"Arooj Aftab, Shabaka And The Ancestors, Nubya Garcia, Charles Lloyd, Sons of Kemet"
Tierra Whack,"Rapsody, Tkay Maidza, Flo Milli, Leikeli47, JUNGLEPUSSY"
BLK ODYSSY,"Rayana Jay, Amaria, Jordan Ward, Sir, masego"
Orillia,"Griefeater, Veisalgia, Close Kept, The Roof Dogs, Stalled"
Sam Pacchioli,"Cloud Signals, Lopi, Max Helgemo, Truman Sinclair, Oscar Lindsey"
Juniper,"Flipturn, Hugh Hardie, Half Moon Run, Aphrodite, The Backseat Lovers"
Matt Nathanson,"Mat Kearney, Howie Day, Joshua Radin, Five for Fighting, Gavin DeGraw"
Duke & Jones,"Peekaboo, Lynnic, Jauz, The First Station, Ekali"
Responsables No Inscriptos,"Mal Pasar, Superuva, Cadena Perpetua, Mal Momento, Loquero"
Luke Buda,"The Reduction Agents, Samuel Flynn Scott, Age Pryor and The Marvellous Medicine, Tessa Rain and Age Pryor, Age Pryor"
ad harmony,"PROJECT FIXATE, Former Days, Incomingon, I Luca, Second Breakfast"
Dorio,"Chinless Wonder, daphne tunes, Dazies, INTAC, miicah"
Sonic Youth,"Ciccone Youth, Thurston Moore, Dinosaur Jr., Unwound, Pixies"
Sue Foley,"Deborah Coleman, Samantha Fish, Tinsley Ellis, Ana Popovic, Joanne Shaw Taylor"
Gregory Alan Isakov,"Caamp, The Paper Kites, John Vincent III, Lord Huron, The Head and the Heart"
Willi Carlisle,"Nick Shoulders, Benjamin Tod, Vincent Neil Emerson, Sierra Ferrell, ian noe"
Shakey Graves,"Houndmouth, Caamp, Nathaniel Rateliff, Mt. Joy, Watchhouse"
Toledo,"Runnner, Cal in Red, Ethan Tasch, Husbands, Adam Melchor"
Kat Velasco,"Lucy Scholl, Genevieve Fisher, Amanda Jordan, Tiffany Woys, Karissa Ella"
Seven Eight Nine: 1975–1976,"The Rise of the Six: 1966–1972, Debut: 1973–1975, The Numbers Tour: 1976–1977, Then and Now: 1979–Present, Chicago Stadium: July 12, 1979"
Marty Haugen,"David Haas, Dan Schutte, Bernadette Farrell, St. Louis Jesuits, John Michael Talbot"
Beyoncé,"The Carters, Destiny's Child, Chlöe, Chloe x Halle, Victoria Monét"
The Mowgli's,"Young Rising Sons, Magic Giant, American Authors, Smallpools, Neon Trees"
His His,"Jack Keyes, Chinless Wonder, Thomas Flynn, Bistro Plate, Hot Left Pole"
girl ultra,"Foudeqush, Ruzzi, Vanessa Zamora, Aquihayaquihay, Girl Ultra & Little Jesus"
Gum,
Merlin Brando,
Empire of the Sun,"Miami Horror, Pnau, Capital Cities, Roosevelt, Cannons"
Juicy J,"DJ Paul, Three 6 Mafia, Project Pat, Gucci Mane, Young Dolph"
The War on Drugs,"The National, Wild Pink, Kurt Vile, Strand of Oaks, Band of Horses"
H. Hawkline,"Cate le Bon, Gorky's Zygotic Mynci, Gruff Rhys, Mega Bog, Woods"
provoker,"Future Nobodies, Blood Club, NYXJVH, French Police, DustBowlChampion"
Cate Le Bon,
Ítallo,"Cátia de França, Dora Morelenbaum, Bruno Berle, Ítallo, Marina Nemesio, Buck Meek"
Andrew Belle,"Harrison Storm, Dustin Tebbutt, Aron Wright, Allman Brown, Old Sea Brigade"
The Story So Far,"No Pressure, Knuckle Puck, Neck Deep, Real Friends, State Champs"
Helena Deland,"Julie Byrne, Hand Habits, Jess Williamson, Maria BC, Sun June"
NTsKi,
Hurray For The Riff Raff,"Jess Williamson, Torres, Madi Diaz, Bonny Light Horseman, Helado Negro"
Ceylon Sailor,"Max Bloom, Martin Frawley, Humdrum, Hinds, The Kosmics"
Sun June,"Madeline Kenney, Helena Deland, ian sweet, Why Bonnie, Al Menne"
G3 GELO,"1900Rugrat, Fetty Wap, RRoxket, Quality Control, BigXthaPlug"
Phoebe Go,"Armlock, Eliza & The Delusionals, BABEHOVEN, Middle Kids, Work Wife"
Elaine Stritch,"Mandy Patinkin, Pamela Myers, Shoshana Bean, Rachel Bay Jones, Dorothy Loudon"
The Utah Valley Children's Choir,"Michael R. Hicks, McKenna Hixson, Benn Cole, Garth Smith, Lacie Kirk"
Quinn Devlin,"Champagne Lane, Danny and Alex, Tomar and the FCs, Menna, Deegan"
Known Moons,"Contrakids, Hear Hums, Pariah Carey, Man Eating Sloth, Magical Mistakes"
"LOU KAENA, Bassment","Jule X, Lil Bruzy, Pablo Nouvelle, Nativ, Jule X, Nicky B Fly, Mimiks, LCone, Astro Burger, Jule X"
El Goodo,"Acid Casuals, Ffa Coffi Pawb, Race Horses, Zabrinski, The Peth"
Alex Sipiagin,"David Binney, Scott Colley, Adam Rogers, David Kikoski, Seamus Blake"
ivri,"Alex Sloane, Bathe Alone, Take Van, sodistilled, Max Fry"
Wolfmother,"Eagles of Death Metal, Them Crooked Vultures, Rival Sons, Jet, Queens of the Stone Age"
Kelly Clarkson,"P!nk, Carrie Underwood, Leona Lewis, JoJo, Ashlee Simpson"
Suki Waterhouse,"Gracie Abrams, Sarah Kinsley, Etta Marcus, Ha Vay, Lorde"
Gabe Goodman,"Homeschool, Sara Keden, Wormy, Howdy, hearing aid beige"
JID,
Kris Kross,"Tag Team, Naughty By Nature, Wreckx-N-Effect, MC Hammer, DJ Jazzy Jeff & The Fresh Prince"
Harry Bloom,"Glade, Skeru, Kal Koren, Amber Sky, Barkérby"
brotherkenzie,"Hippo Campus, Samia, Adam Melchor, BABY BOYS, Vista Kicks"
aufnkaffeemitrauf,
Title Fight,"Basement, Modern Color, Joyce Manor, Citizen, Tigers Jaw"
Dawes,"The Avett Brothers, Josh Ritter, Hiss Golden Messenger, Blitzen Trapper, Deer Tick"
Hemlock,"Combat, Mamaleek, Ada Lea, Allegra Krieger, Sinai Vessel"
Frontier Ruckus,"The Low Anthem, A.A. Bondy, Hiss Golden Messenger, The Avett Brothers, Damien Jurado"
The Diplomats,"Cam'ron, Juelz Santana, Jim Jones, Beanie Sigel, Jadakiss"
Morgan Wade,"Ashley McBryde, Carly Pearce, Hailey Whitters, Lainey Wilson, Charles Wesley Godwin"
Jonathan Traylor,"Dante Bowe, Zoe Music, Courtnie Ramirez, Church of the City, Cade Thompson"
aldn,
Ages and Ages,"Sure Sure, The Dodos, Blind Pilot, Cloud Cult, Fruit Bats"
Carly Pearce,"Maddie & Tae, Kelsea Ballerini, Lainey Wilson, Tenille Arts, Ashley McBryde"
Middle Sattre,"Large Brush Collection, Molly Sarlé, Renée Reed, Katie Bejsiuk, Swimming Bell"
Eamon Fogarty,"Hollow Hand, Neil Brogan, Yung Wu, New Starts, Dumb Things"
Fight Cloud,"abelia, The Most, Black Dirty, Trying Science, Bearcubbin'!"
IDK,"Kenny Mason, EarthGang, Smino, Aminé, Guapdad 4000"
Bizhiki,"Bonny Light Horseman, Jake Blount & Mali Obomsawin, Ben Seretan, Andrew Bird & Madison Cunningham, Lutalo"
Tiger Darrow,"Oh Darling, Lindsey Smith, Rachel Browne, Rachel McGoye, Katie Todd"
Chapter Thirty-four,
J. Cole,"Jid, Bas, Cozz, Dreamville, Joey Bada$$"
Aoife O'Donovan,"I'm With Her, Crooked Still, Sarah Jarosz, Sara Watkins, I’M WITH HER"
Jacques Dutronc,"Eddy Mitchell, Julien Clerc, Serge Gainsbourg, Alain Souchon, Michel Polnareff"
Magana,"Bridget Kearney, Tara Jane O'Neil, Josaleigh Pollett, Jack Hayter, Ciao Malz"
Chris Chism,
Peter Gabriel,"Genesis, Tony Banks, Steve Hackett, Marillion, Phil Collins"
Josh Spinner,"Ocean Child, Garden Girl, Emily How, Alex Schlupp, Sitrus Sol"
Soccer Mommy,"Snail Mail, Momma, Nilüfer Yanya, Julia Jacklin, Indigo De Souza"
Ray LaMontagne,"Ray LaMontagne and the Pariah Dogs, Amos Lee, David Gray, Alexi Murdoch, Nathaniel Rateliff"
Justice,"Sebastian, Busy P, Daft Punk, Breakbot, Mr. Oizo"
Snapcase,"Earth Crisis, Strife, Vision of Disorder, Quicksand, Poison the Well"
The Blessed Madonna,"Nathan Dawe, Sonny Fodera, Purple Disco Machine, Eliza Rose, KC Lights"
Lunar Moth,"Smoke Free Home, Social Cig, BUG MOMENT, Scam Likely, Shoobie"
Pom Poko,"Finom, Fake Fruit, Personal Trainer, Spirit of the Beehive, Deerhoof"
Shawna Edwards,"Mack Wilberg, Tanner Linford, Lex de Azevedo, Blake Gillette, McKenna Hixson"
The Foundations,"The Archies, Maxine Nightingale, The Four Tops, Frankie Valli, Frankie Valli & the Four Seasons"
Hana Vu,"mui zyu, Jay Som, Wishy, Lala Lala, ian sweet"
Chapter Twenty-five,"Chapter Twenty-Nine, Chapter Twenty-Seven, Chapter Twenty-Six, Chapter Twenty-Two, Chapter Twenty-One"
River Whyless,"Jesse Woods, The Ballroom Thieves, Richy Mitch & The Coal Miners, Gregory Alan Isakov, John Vincent III"
Owen,"Into It. Over It., American Football, Pedro the Lion, Their / They're / There, Everyone Everywhere"
Goldie Boutilier,"Goldilox, Allie X, ionnalee, Empress Of, Baby Storme"
Emmitt James,"Mushiya, G.O.A.T Wavy, Ajan, Ross T, Wayne Jetski"
Demi Lovato,"Demi Lovato & Joe Jonas, Miley Cyrus, Fifth Harmony, Kelly Clarkson, Selena Gomez & the Scene"
Jet Trouble,"Much More, Kelsey Breedlove, Zoe Music, Isly, Laity"
The Hunts,"Cereus Bright, Tow'rs, Roo Panes, The Oh Hellos, Bronze Radio Return"
Post Malone,"Tyla Yaweh, The Kid Laroi, Jack Harlow, 24kgoldn, Arizona Zervas"
Floopy,"メトロノーム, 曖昧中毒, 新宿ゲバルト, ピノキヲ, COSMO-SHIKI"
Jamila Woods,"L’Rain, Sudan Archives, Tirzah, SERPENTWITHFEET, Nourished by Time"
Good Kid,"Phoneboy, The Rare Occasions, The Happy Fits, Last Dinosaurs, James Marriott"
Kacy & Clayton,"Marlon Williams, Jesse Woods, Blaze Foley, The Cactus Blossoms, Esther Rose"
Crowded House,"Neil Finn, Finn Brothers, Split Enz, Tim Finn, Cold Chisel"
Far,"Hum, Quicksand, Rival Schools, Onelinedrawing, Jawbox"
Prince,"Prince and the New Power Generation, Prince & The Revolution, The Time, Sheila E., Wendy & Lisa"
Snowgoose,"mike polizze, Gabby Barret, Original Broadway Cast of 'Hamilton', Eva Tanguay, Mark Ronson And Bruno Mars"
Gilligan Moss,"Brijean, Neil Frances, Mindchatter, Bay Ledges, Leisure"
Is This Thing On,"Dot Operator, Mister Goblin, Night Jobs, la scène 裸身, Laika Songs"
TOMORROW X TOGETHER,"Yeonjun, TOMORROW X TOGETHER, Jonas Brothers, TOMORROW X TOGETHER, Anitta, ENHYPEN, boynextdoor"
Chapter Twenty,"Chapter Twenty-One, Chapter Twenty-Four, Chapter Twenty-Three, Chapter Seventeen, Chapter Eighteen"
"Yard Act, Katy J Pearson","Yard Act, IDLES, LCD Soundsystem, Deadletter, Waxahatchee, MJ Lenderman, Big Special"
Joywave,"Big Data, Best Frenz, Sir Sly, Foreign Air, Battle Tapes"
Matt Maltese,"Strawberry Guy, The walters, grentperez, Ricky Montgomery, Etta Marcus"
macseal,"sports., Marietta, oso oso, Michael Cera Palin, Charmer"
"Bessie Smith, Louis Armstrong","Ma Rainey, Ethel Waters, Memphis Minnie, Leadbelly, Billie Holiday"
Brent Faiyaz,"Sonder, Bryson Tiller, Paperboy Fabe, AveNoir, Daniel Caesar"
The Wicked Orchestra,"Jeff Goldblum, Peter Dinklage, Cynthia Erivo, Jonathan Bailey, Kristin Chenoweth & Idina Menzel"
The Wombats,"Love Fame Tragedy, Circa Waves, Sea Girls, Catfish and The Bottlemen, The Pigeon Detectives"
Snow Patrol,"Travis, Keane, Athlete, Stereophonics, Editors"
Tim Vantol,"Northcote, John Allen, Sam Russo, Chris Wollard & The Ship Thieves, Jared Hart"
Amber Mark,"Mahalia, Nao, Victoria Monét, Joyce Wrice, VanJess"
Tali & The Arms,"The Vovos, Dog door, Zoë Fromer, Dr Sure's Unusual Practice, Hot Brother"
Ms. Lauryn Hill,"Fugees, Ms. Lauryn Hill, Wyclef Jean, Pras, Erykah Badu, Lucy Pearl, Solange, The Carters"
The Proclaimers,"Runrig, Deacon Blue, Billy Bragg, Del Amitri, The Beautiful South"
Ceremony,"Trapped Under Ice, Angel Du$t, Have Heart, Blacklisted, Weekend Nachos"
Pale Waves,"Fickle Friends, Stand Atlantic, Yours Truly, The Aces, CHVRCHES"
Ramones,"Joey Ramone, The Clash, Sex Pistols, Buzzcocks, Misfits"
Vanja V,"mgpjr, Vilde og Anna, Jørgen, Unik 4, Johanne Holmedahl"
Bedouine,"Tomberlin, Molly Burch, Julie Byrne, Aldous Harding, Helena Deland"
Bo Burnham,"Tom Cardy, Ninja Sex Party, Danny gonzalez, The Lonely Island, Starbomb"
"Josaleigh Pollett, Crowd Shy","Josaleigh Pollett, Crowd Shy, Aisling, Nicole Canaan, Josaleigh Pollett, Miranda Mallard, McKenna Alise & the Great Galvanic Divide, Good Morning Midnight"
Ambar Lucid,"Nina Cobham, Telenova, Carla Morrison, Noémie Wolfs, benee"
M.A.G.S.,"Trudy and the Romance, Hot Flash Heat Wave, Ultra Q, The Symposium, Peach Pit"
Djo,"Tame Impala, Dayglow, Mild High Club, Crumb, Foxygen"
Rattlesnake Milk,"Nick Shoulders, Vincent Neil Emerson, Charley Crockett, Brent Cobb, Emily Nenni"
Allyse Smith,"Michael R. Hicks, Beyond 5, Reese Oliveira, Rebecca Mohler, Linda Rowberry"
Charlie Hickey,"Christian Lee Hutson, Samia, Claud, Better Oblivion Community Center, Maya Hawke"
Fousheé,"Ravyn Lenae, Fana Hues, Orion Sun, 070 Shake, Solange"
Annie Lennox,"Eurythmics, Alison Moyet, Bette Midler, Lisa Stansfield, Texas"
Four Tet,"Floating Points, Burial & Four Tet, Jon Hopkins, Caribou, Rival Consoles"
Sampha,"James Blake, SBTRKT & Sampha, Anderson .Paak, Jordan Ward, DIJON"
