Artist,Similar Artists
"Benny Andersson, Björn Ulvaeus, Lisa Stokke, Hilton McRae, Paul Clarkson, Nicolas Colicos","Benny Andersson, Björn Ulvaeus, Stig Anderson, Siobhan McCarthy, Nicolas Colicos, Paul Clarkson, Hilton McRae, Benny Andersson, Björn Ulvaeus, Siobhan McCarthy, The Dynamos, Benny Andersson, Björn Ulvaeus, Stig Anderson, Lisa Stokke, Hilton McRae, Paul Clarkson, Benny Andersson, Björn Ulvaeus, Stig Anderson, Jenny Galloway, Louise Plowright, Siobhan McCarthy, Benny Andersson, Björn Ulvaeus, Andrew Langtree, Lisa Stokke, Nigel Harman, Neal Wright"
Colin Macleod,"C.Macleod, Sunflower Thieves, Callum Pitt, Beluga Lagoon, James Walsh"
Empress Of,"Tei Shi, Fabiana Palladino, Allie X, Cecile Believe, ionnalee"
Babe Corner,"Hey Cowboy!, Sasha and the Valentines, Central Heat Exchange, Bridal Party, Spud Cannon"
Garnish,"Boondogs, Nice Guy Eddie"
Opening Credits,"Chapter 1, End Credits, Chapter 2, Chapter 5, Introduction"
Iji,"Your Heart Breaks, eskimeaux, Wisdom Tooth, Best Friends Forever, Sourpatch"
Ilsey,"Bon Iver, Bonny Light Horseman, Morgan Wade, Ruston Kelly, Dylan LeBlanc"
Joji,"rei brown, 88Rising, d4vd, Frank Ocean, Keshi"
Pulp,"Jarvis Cocker, Suede, Blur, Elastica, The Stone Roses"
prodbycpkshawn,"Bryansanon, fazobeats, NXY0TAR0, sma$her, Odetari, Ayesha Erotica"
Eline Thorp,"Maria Celin, Tiril, Akuvi, Umami Tsunami, Atle Pettersen"
AC/DC,"Ozzy Osbourne, Airbourne, Motörhead, Aerosmith, Guns N' Roses"
Dean Johnson,"Bella White, Nick Shoulders, Vincent Neil Emerson, Kassi Valazza, Sierra Ferrell"
"Benny The Butcher, Pusha T","Benny The Butcher, 38 Spesh, Jadakiss, Benny The Butcher, Harry Fraud, Benny The Butcher, India, Benny The Butcher, Black Thought, Conway The Machine, Westside Gunn, Benny The Butcher"
Julian Lage,"Bill Frisell, Charles Lloyd, Julian Lage & Chris Eldridge, Kurt Rosenwinkel, John Scofield"
Nick Wheeldon,"Pop Crimes, TH Da Freak, Arthur Satàn, Coeur Joie, Fontanarosa"
Cormac O Caoimh,"Todd & Karen, Eric Michael Jones, MIK's Reaction, Emma Dupéré, Dream Optimist"
Phoneboy,"Good Kid, The Happy Fits, Keanu Bicol, The Royston Club, The Rare Occasions"
Coin,"Bad Suns, Hippo Campus, Dayglow, Hunny, lovelytheband"
Favored Nations,"The Chain Gang of 1974, Age of Consent, Dan Croll, Battle Tapes, Panama"
1990nowhere,"Asking For A Friend, La Bouquet, Fox Royale, silver & gold, Cloudland"
Chapterhouse,"Pale Saints, Ride, Lush, Swervedriver, Catherine Wheel"
The Mysterines,"The Blinders, Black Honey, The Amazons, Dream Wife, Royal Blood"
lobsterfight,"Kara's Walk Home, exciting!!excellent!!, home is where, The Brave Little Abacus, awakebutstillinbed"
Chloe Slater,"better joy, BBY, Etta Marcus, Bel, total tommy"
"Celofán., Juan Esteban Dimate, Santiago Agamez",
Cola,"Ought, Wombo, Deeper, Folly Group, Bodega"
Many Eyes,"Better Lovers, Every Time I Die, Greyhaven, Dead Icarus, 156/Silence"
DEAD POET SOCIETY,"Cleopatrick, Highly Suspect, Reignwolf, Electric Enemy, Badflower"
Two Door Cinema Club,"The Wombats, Foster the People, Saint Motel, Circa Waves, The Kooks"
Beach Bunny,"Chloe Moriondo, Frances Forever, The Beths, Ricky Montgomery, Sir Chloe"
Toby Romeo,"Glockenbach, Younotus, Felix Jaehn, twocolors, Joel Corry"
Squid,"Shame, BLACK MIDI, Squid & Martha Skye Murphy, Geese, Black Country, New Road"
Average White Band,"Ohio Players, Tower of Power, Brothers Johnson, The J.B.'s, Maceo Parker"
The Faim,"Oh The Larceny, City Wolf, Random Hero, needshes, The Unlikely Candidates"
Norah Jones,"The Little Willies, Diana Krall, Madeleine Peyroux, Melody Gardot, Eva Cassidy"
Rubblebucket,"Caroline Rose, Generationals, Ra Ra Riot, Thao & The Get Down Stay Down, Bad Bad Hats"
Félixe,
Archers of Loaf,"Superchunk, Sebadoh, Silkworm, Guided by Voices, Built to Spill"
Jerry Douglas,"Tony Rice, The Tony Rice Unit, Sam Bush, Norman Blake, Tim O'Brien"
Dustin Kensrue,"Right Away, Great Captain!, Kevin Devine, Noah Gundersen, City and Colour, David Bazan"
Men Without Hats,"Wang Chung, A Flock of Seagulls, Real Life, The Human League, Thompson Twins"
22º Halo,"JoyeR, Crisman, Kitchen, A Country Western, A Wonderful"
Phantastic Ferniture,"Julia Jacklin, Middle Kids, WaaX, Body type, Jack River"
Oblivion,"Louaminé, Alustrium, Kirabuo, Auðura, Neuraxis"
Michael Nau,"Cotton Jones, Chris Staples, Cut Worms, Vetiver, Holy Hive"
M83,"Sigur Rós, Explosions in the Sky, Hammock, Washed Out, Cut Copy"
Voxtrot,"Someone Still Loves You Boris Yeltsin, Generationals, Ra Ra Riot, Miniature Tigers, Coconut Records"
Paramore,"Hayley Williams, Fall Out Boy, Avril Lavigne, Tonight Alive, PVRIS"
Joni Mitchell,"Judee Sill, Joan Baez, Joanna Newsom, Laura Nyro, Laura Marling"
Haloo Helsinki!,"Kaija Koo, Jenni Vartiainen, Anssi Kela, Ellinoora, Juha Tapio"
Lime Garden,"Prima Queen, Yard Act, Pip Blom, Courting, English Teacher"
Sound mind,"Sleep Parade, Pludo, Cyrenic, Sydonia, Surfact"
Chatham County Line,"Steep Canyon Rangers, The Del McCoury Band, Chuck Prophet, The Gourds, Old Crow Medicine Show"
Stacks,"18 Rays, Au Suisse, Causeway, Jet Hammer, Meetsysteem"
Weezer,"Rivers Cuomo, The Rentals, OZMA, Green Day, The Presidents of the United States of America"
The Lemon Twigs,"Todd Rundgren, Big Star, The Raspberries, Foxygen, Jellyfish"
Grouplove,"Cold War Kids, Foster the People, Sir Sly, Passion Pit, Atlas Genius"
Anxious,"One Step Closer, Koyo, Fiddlehead, No Pressure, The Story So Far"
Mono,"This Will Destroy You, Caspian, pg.lost, The Evpatoria Report, Sleepmakeswaves"
The Emotions,"A Taste Of Honey, The O'Jays, Cheryl Lynn, Gladys Knight & The Pips, The Jones Girls"
Battles,"Don Caballero, Tera Melos, Tortoise, Holy Fuck, Hella"
Teddy Swims,"Victor Ray, Rag'n'Bone Man, goldford, JP Cooper, John Legend"
Aden Foyer,"Joseph Kamel, Ray Dalton, Tom Gregory, Boris Way, loi"
bathtub cig,"pictoria vark, Wormy, Ivers, MIKE KOTA, Wilma Laverne Miner"
The Nunnery,"Heart Bones, Candid Kid, bathtub cig, Briana Marela, Lucy Michelle and the Velvet Lapelles"
"PNAU, Empire of the Sun","Empire of the Sun, PNAU, Bebe Rexha, Ozuna, Pnau, PNAU, Emily Wurramara, Calvin Harris, Rag'n'Bone Man"
Hum,"Failure, Shiner, Centaur, Far, Sunny Day Real Estate"
glaive,
Freckle,"DSPS, dadado huang, Fragile girls, Wonfu, shallow levée"
Jimmy Montague,"Broken Record, Tree River, Swim Camp, Rat Tally, Eli Winter"
Jonathan Bailey,"Cynthia Erivo, The Wicked Orchestra, Kristin Chenoweth & Idina Menzel, Idina Menzel & Leo Norbert Butz, Stephen Schwartz"
"Charlotte Day Wilson, Snoh Aalegra","Charlotte Day Wilson, Snoh Aalegra, Jorja Smith, Lila Iké, Majid Jordan, Naomi Sharon, Maeta, Free Nationals"
Art School Girlfriend,"Two People, Bleach Lab, Glasser, Tusks, Ex:Re"
Julia Jacklin,"Stella Donnelly, Indigo De Souza, Angel Olsen, Tomberlin, Lucy Dacus"
The Chicks,"Miranda Lambert, Jo Dee Messina, Maren Morris, Faith Hill, Trisha Yearwood"
Jay Som,"Japanese Breakfast, Slow Pulp, tanukichan, Barrie, Snail Mail"
There Will Be Fireworks,"Frightened Rabbit, Owl John, Moving Mountains, We Were Promised Jetpacks, The Twilight Sad"
Kenita Miller,"Sasha Hutchings, Colman Domingo, Aneesa Folds, James Remar, Utkarsh Ambudkar"
Loverboy,"Billy Squier, Eddie Money, Night Ranger, .38 Special, Rick Springfield"
Party of the Sun,"Thomas LaVine, Frances Luke Accord, Beau Turrentine, RYVOLI, Airpark"
Haley Heynderickx,"AdriAnne Lenker, Lomelda, Big Thief, Julia Jacklin, Odie Leigh"
Lomelda,"Florist, Skullcrusher, Katy Kirby, Haley Heynderickx, AdriAnne Lenker"
Husbands,"sjowgren, dayaway, Bay Ledges, Beach Vacation, Goth Babe"
Courtney Barnett,"COURTNEY BARNETT & KURT VILE, Julia Jacklin, The Beths, Kurt Vile, Parquet Courts"
"serpentwithfeet, Ty Dolla $ign, Yanga YaYa","SERPENTWITHFEET, serpentwithfeet, Mick Jenkins, serpentwithfeet, Orion Sun, Jamila Woods, Doechii, JT"
Alex the Astronaut,"Ruby Fields, Josh Pyke, Alex Lahey, Thelma Plum, The Rubens"
Jinski,"Johnny Badapple, Doghouse Roses, Phil Beer, Ashley Hutchings, Spiers & Boden"
Japanese Breakfast,"Alvvays, Jay Som, Snail Mail, Soccer Mommy, Bumper"
Black Bile,"Iress, Frayle, (DOLCH), Faetooth, Hangman's Chair"
Charley Crockett,"Vincent Neil Emerson, Colter Wall, Sturgill Simpson, Sierra Ferrell, Tyler Childers"
Yacht,"The Blow, Holy Ghost!, !!!, Starfucker, Datarock"
Rural France,"motorists, The Boys with the Perpetual Nervousness, Young Scum, Mt. Misery, The Stroppies"
The Innocence Mission,"The Weepies, Laura Marling, The Weather Station, Laura Veirs, Vashti Bunyan"
Your Old Droog,"Roc Marciano, Tha God Fahim, Mach-Hommy, Estee Nack, Conway the Machine"
The Used,"Taking Back Sunday, Gerard Way, My Chemical Romance, Frank Iero, Pencey Prep"
Mapei,"Peg Parnevik, Iggy Azalea, Projota, Brooke Candy, Miriam Bryant"
The Doppelgangaz,"Planet Asia, Artifacts, Evidence, Godfather Don, Large Professor"
Botticelli Baby,"Footprint Project, Duo Stiehler/Lucaciu, 2ersitz, MUITO KABALLA, Johanna Summer"
Lily Allen,"Kate Nash, Tove Lo, Natalia Kills, Nicola Roberts, Gwen Stefani"
Oscar Peterson Trio,"Oscar Peterson, McCoy Tyner, Bill Evans Trio, Cannonball Adderley, Ben Webster & Oscar Peterson"
Palmenia Pizarro,"Lucho Barrios, Ramón Aguilera, Zalo Reyes, Jorge Negro Farías, Luis Dimas"
Daryl Johns,"Anna Butterss, Allegra Krieger, Merce Lemon, Why Bonnie, Nubya Garcia"
Colour,"Tangled Hair, Meet Me In St. Louis, Tubelord, This Town Needs Guns, Delta Sleep"
Rupert Holmes,"Player, Looking Glass, Stephen Bishop, Orleans, Ambrosia"
Napolia,"Knóws, Lany Mokita, Meu Malu, Mimber, Lifou"
Long Live The Empire,"Carpet Golf, Xingfoo&Roy, Terrible People, Saints Amongst Sinners, Susurrus"
Kali Malone,"Sarah Davachi, Ellen Arkbro, caterina barbieri, William Basinski, Éliane Radigue"
Second Breakfast,"I Luca, Former Days, ad harmony, Incomingon, PROJECT FIXATE"
Savage Garden,"Darren Hayes, Boyzone, Backstreet Boys, Five, Ronan Keating"
Hanson,"Aaron Carter, O-Town, Backstreet Boys, M2M, *NSYNC"
Old Lady,"Ma'am, Kailey Rocker, Sweet Pete, Phil Spector's Gun, ZZZWalk"
Reno Dakota,"Papayér, saleontomorrow, Manbearpig, NGOD, your neighbour the liar"
Shenseea,"Vybz Kartel, Dexta Daps, Jada Kingdom, Popcaan, Spice"
Kelis,"Amerie, Tweet, Brandy, Missy Elliott, Janet Jackson"
KAYTRANADA,
Camille Faulkner,
Mecano,"Alaska y Dinarama, Miguel Bosé, La Oreja de Van Gogh, Flans, Ana Torroja"
The Belle Weather,"Newski, Brett Newski, Girl and the Gunn, Kurt Gunn, Christopher Gold & the New Old Things"
Suzanne Vega,"Shawn Colvin, Tanita Tikaram, Aimee Mann, Beth Orton, Natalie Merchant"
Yoon Han,"Crazymilk, Yoonhan, Learn Key, LEE JIN WOOK, 랄라스윗(lalasweet)"
Jordana,"TV Girl, lunar vacation, Strawberry Guy, The Simps, VACATIONS"
Carrtoons,"Reuben James, Pale Jay, Terrace Martin, Butcher Brown, DJ Harrison"
Floating Points,"Four Tet, Jamie xx, Joy Orbison, Nicolas Jaar, Djrum"
The Joy Formidable,"Silversun Pickups, Blood Red Shoes, The Duke Spirit, Black Honey, We Were Promised Jetpacks"
Trinelise Væring,"Jennifer Christine, Coldplayers, Tobias Trier, Maria Montell, Citybois"
Leikeli47,"Cakes Da Killa, Iamdoechii, Princess Nokia, QUAY DASH, JUNGLEPUSSY"
Mick Jenkins,"EarthGang, Reason, Isaiah Rashad, Saba, Smino"
Rammstein,"Lindemann, Till Lindemann, Emigrate, Eisbrecher, Oomph!"
Ella Fitzgerald,"Ella Fitzgerald & Louis Armstrong, Sarah Vaughan, Billie Holiday, Louis Armstrong, Dinah Washington"
Stevie Wright,"Cold Chisel, The Easybeats, Richard Clapton, Hunters & Collectors, Daddy Cool"
"Eurythmics, Annie Lennox, Dave Stewart","Fine Young Cannibals, Yazoo, Nik Kershaw, Paul Young, Level 42"
Gunna,"Lil Keed, Young Thug, Lil Baby & Gunna, Lil Baby, Lil Gotit"
Mt. Joy,"Caamp, Sumbuck, Houndmouth, Richy Mitch & The Coal Miners, Sam Burchfield"
"Charlotte Cardin, Skiifall","Spanish Flow, Freedom Dub, Pastora Andrades, Matt Wertz, Lloyiso, Henry, Yuna, Charlotte Cardin"
Our Girl,"the orielles, Swim Deep, DIIV, Coach Party, Van Houten"
Jonathan Hultén,"Árstíðir, Sangre de Muerdago, Vàli, MCC [Magna Carta Cartel], Petr Kalandra"
Starflyer 59,"blue smiley, VIVIENNE EASTWOOD, Fleeting Joys, Knifeplay, Rocketship"
sjowgren,"Husbands, Generationals, Sure Sure, Abby Sage, Bad Bad Hats"
PUP,"Jeff Rosenstock, Prince Daddy & The Hyena, Joyce Manor, Bomb the Music Industry!, Remo Drive"
Fontaines D.C.,"Wunderhorse, The Murder Capital, Idles, Shame, Deadletter"
Oddfish,"Sofasound, Kissamilé, Masked Man, Ian Ewing, Anbuu"
Wolf Ticket,Go Diana
Grady Philip Drugg,"Mint Fatigues, Turtle Soup, Hudson Freeman, RED SONIC, Transparence"
Bronski Beat,"The Communards, Yazoo, Soft Cell, Visage, Jimmy Somerville"
Billie Holiday,"Billie Holiday and Her Orchestra, Ella Fitzgerald, Sarah Vaughan, Dinah Washington, Ella Fitzgerald & Louis Armstrong"
Huey V,"Shaun Sloan, 100k Track, Taleban Dooda, Tayy Brown, 3xbravo"
Empire! Empire! (I Was a Lonely Estate),"Joie De Vivre, Mineral, Algernon Cadwallader, Snowing, Marietta"
Amythyst Kiah,"Allison Russell, Our Native Daughters, Adia Victoria, Yasmin Williams, Valerie June"
Vansire,"Far Caspian, no vacation, RICEWINE, Castlebeat, Yot Club"
Mdou Moctar,"Etran de L'AÏr, Tinariwen, Les Filles De Illighadad, Bombino, Imarhan"
Brigitte Calls Me Baby,"86TVs, BBY, Quivers, Hamish Hawk, King Hannah"
Hello Shark,"A Wonderful, Chatterton, Kitchen, The Loners With Parentheses, mathew lee cothran"
The Roots,"Common, Black Thought, Black Star, Talib Kweli, A Tribe Called Quest"
Merce Lemon,"Allegra Krieger, This is Lorelei, Why Bonnie, Peel Dream Magazine, Christopher Owens"
Dua Lipa,"Ava Max, Katy Perry, Zara Larsson, Silk City, Camila Cabello"
Maggie Rogers,"Muna, Holly Humberstone, Katie Gavin, Del Water Gap, HAIM"
Jack M. Senff,"Derek Ted, Steve Marino, Dead Gowns, hahawiener420, String Machine"
Dork,"geniality, Forged In Violet, John Quill, Solecism, The Masquerade Scene"
Ishan,"Sean Paul, Kamille, Conor Maynard, Shenseea, Lucky Dube"
Mustard,"YG, Rich The Kid, Big Sean, Future & Metro Boomin, Don Toliver"
Spllit,"Uranium Club, Alien Nosejob, Stuck, Tee Vee Repairmann, R.M.F.C."
Gracie and Rachel,"Huxlee, Moxi, Little Red Lung, Rebecca Clements, Moonrise Nation"
Tomin,"Anna Butterss, Sml, Work Money Death, Ruth Goller, Asher Gamedze & The Black Lungs"
Megan Thee Stallion,"Latto, Glorilla, Cardi B, Flo Milli, Monaleo"
Long Cut,"Apalachee Don, Mic Manik, Tommy Chayne, Tennessee Shine, Franklin Embry"
Montell Jordan,"Blackstreet, Next, 112, Donell Jones, Bobby Brown"
Soap&Skin,"CocoRosie, Chelsea Wolfe, Anna von Hausswolff, Agnes Obel, Dillon"
DreamAge,"you, infinite, Made Of Light, Electric Alchemy, øverst, The Introvert"
The Tragically Hip,"Gord Downie, Sam Roberts, 54-40, Headstones, Matthew Good Band"
Slow Pulp,"Mia Joy, Momma, tanukichan, Wednesday, ratboy"
Esther Rose,"Shannon Lay, Jess Williamson, Anna St. Louis, Sierra Ferrell, Kacy & Clayton"
Semisonic,"Better Than Ezra, Gin Blossoms, The Verve Pipe, The Wallflowers, Fastball"
Sabrina Carpenter,"Olivia Rodrigo, Gracie Abrams, Taylor Swift, Ariana Grande, Madison Beer"
yaya bey,"Rayana Jay, Pale Jay, Ray Lozano, Sault, Greentea Peng"
Barry Cavanagh,"Cathy Rigby, Aistis, Michael Nostrand, kendall lujan, Terminally Phil"
S. Carey,"Foreign Fields, Volcano Choir, Bon Iver, Benjamin Francis Leftwich, James Vincent McMorrow"
Mutual Benefit,"Youth Lagoon, Julie Byrne, Woods, Kevin Morby, Helena Deland"
Julian Cope,"The Teardrop Explodes, The Blue Aeroplanes, That Petrol Emotion, The Wedding Present, Robyn Hitchcock and The Egyptians"
boygenius,
Barenaked Ladies,"Toad The Wet Sprocket, Gin Blossoms, Hootie & The Blowfish, Sister Hazel, Fastball"
Chastity,"Drug Church, Cold Gawd, The Dirty Nil, Narrow Head, Planes Mistaken For Stars"
Threepwood ´N Strings,"Kilkenny Knights, DOGS FROM THE GRAPES, The Scarlet Scallywags, The Clan, The Trouble Notes"
Etta James,"Aretha Franklin, Nina Simone, Otis Redding, Sam Cooke, Dinah Washington"
"JR JR, Yoke Lore","Ny Oh, Qazi & Qazi, Rufus Wainwright, Choir! Choir! Choir!, Odette, Gretta Ray, Noah Dillon, Asha Jefferies, Afternoon Bike Ride, imagiro"
Wallice,"Spill Tab, Claud, Maude Latour, dora jar, Samia"
Alabama Shakes,"Brittany Howard, St. Paul & The Broken Bones, Black Pumas, The Black Keys, Dan Auerbach"
Jack Harlow,"Drake, Cordae, DaBaby, Roddy Ricch, Logic"
Roosevelt,"Poolside, Miami Horror, St. Lucia, SG Lewis, Goldroom"
Tiana Major9,"Alex Isley, Lucky Daye, India Shawn, Kiana Ledé, Jade Novah"
Omah Lay,"Fireboy Dml, Victony, Ruger, JOEBOY, BNXN"
Super Furry Animals,"Gruff Rhys, Gorky's Zygotic Mynci, Supergrass, The Charlatans, The Bluetones"
Embrace,"Rites of Spring, One Last Wish, Moss Icon, Shed Seven, Athlete"
Clipse,"Pusha T, Ghostface Killah, Jay-Z, N*E*R*D, Cam'ron"
Bow Wow,"Ja Rule, Pretty Ricky, Chingy, Nelly, T-Pain"
Ley Soul,"The Valdons, Amaria, Essosa, Orion Sun, Enny"
This is Lorelei,"Wishy, Wild Pink, Hovvdy, Merce Lemon, 2nd Grade"
Andrew Bird,"M. Ward, Fruit Bats, Beirut, Madison Cunningham, Andrew Bird's Bowl of Fire"
Explosions in the Sky,"This Will Destroy You, Explosions In The Sky & David Wingo, Caspian, Mogwai, The End of the Ocean"
Bag of Cans,"Cat Ryan, Hutch, Dead Pretties, Lady Parts, Scott Lavene"
Cold World,"Trapped Under Ice, No Warning, Killing Time, Death Threat, The Rival Mob"
The Lowlies,"Kyle Brew, Kieran Campbell, Viv & Riley, Two Runner, The Montvales"
Claud,"Samia, Muna, The Japanese House, Wallice, Chloe Moriondo"
Malcolm Gladwell,"David Allen, Dale Carnegie, Michael Pollan, Stephen Hawking, John Steinbeck"
Rufus Wainwright,"Martha Wainwright, Loudon Wainwright III, Ron Sexsmith, k.d. lang, Aimee Mann"
Roddy Ricch,"Polo G, A BOOGIE WIT DA HOODIE, Lil Baby, lil tjay, Gunna"
Soda Blonde,"Little Green Cars, CMAT, Pillow Queens, Bell X1, Sorcha Richardson"
Nancy Wilson,"Carmen McRae, Sarah Vaughan, Etta Jones, Anita O'Day, Lorez Alexandria"
Big Rig,"Classics of Love, Isocracy, Downfall, The Wynona Riders, Cleveland Bound Death Sentence"
Skeru,"Barkérby, Harry Bloom, Mimber, Francis Flo, Víolet Dawn"
Heems,"Das Racist, Kool A.D., Your Old Droog, Ratking, Mr. Muthafuckin' eXquire"
Isaak Young,"Haltura Arnadottir, joy parade, Shape Of Our Dreams, Broken Legacy, Woven Hearts"
Shemekia Copeland,"Charlie Musselwhite, Joanne Shaw Taylor, Selwyn Birchwood, John Mayall, Kenny Neal"
Los Bitchos,"LA LOM, Arc De Soleil, Hermanos Gutiérrez, Real Estate, Los Destellos"
Barry Zito,"Bronson Arroyo, Ben Broussard, The Masked Singer: Bluebell, The Masked Singer: Starfish, The Masked Singer: Ugly Sweater"
Foxing,"The Hotelier, oso oso, The World Is a Beautiful Place & I Am No Longer Afraid to Die, From Indian Lakes, Prawn"
Catatonia,"Cerys Matthews, Echobelly, Sleeper, The Bluetones, Dodgy"
Masked Man,"Kreatev, J.Folk, Kissamilé, El Train, Ward Wills"
Sour Widows,"Robber Robber, good looks, Hannah Frances, BABEHOVEN, Office dog"
Tiawa,"Wheelup, Footshooter, Brién, Marlon McClain, Illnoledge"
Los Campesinos!,"Johnny Foreigner, american poetry club, James Marriott, Martha, LoveJoy"
Hamilton Leithauser,"Hamilton Leithauser + Rostam, The Walkmen, Kevin Morby, Hamilton Leithauser & Rostam, Spoon"
lea thomas,"A.O. Gerber, Molly Sarlé, Olivia Kaplan, Cloudbelly, Flora Hibberd"
Pearla,"Fenne Lily, Hana Lili, Tomberlin, Caroline Rose, Miya Folick"
Chris Acker,"The Sons of Rainier, Sam Doores, Steph Green, Mr. Sam & the People People, Cactus Lee"
DeLoyd Elze,
Rose Hotel,"Dead Gowns, Wilma Laverne Miner, Josaleigh Pollett, Bridget Kearney, Daughter of Swords"
Catherine Russell,"Kat Edmonson, Lorez Alexandria, Jeri Southern, Irene Kral, Ernestine Anderson"
Clementine Was Right,"Farseek, Have A Good Season, Clearbody, Downhaul, Hit Like a Girl"
Gigi Perez,"Them & I, searows, Bon Iver & St. Vincent, Gracie Abrams, Girl In Red"
HanuMankind,
"Mustafa, Daniel Caesar","Mustafa, Clairo, Mustafa, Sampha, Mustafa, Peter CottonTale, Chance the Rapper, Daniel Caesar, Madison Ryann Ward, Rex Orange County, Daniel Caesar, Original Koffee"
Keith & Kristyn Getty,"Sovereign Grace Music, CityAlight, Andrew Peterson, Selah, Shane & Shane"
Drowners,"The Vaccines, Catfish and The Bottlemen, The 1975, Inhaler, The Last Shadow Puppets"
The Doors,"Jim Morrison, Cream, Led Zeppelin, Jimi Hendrix, The Rolling Stones"
Mildura,"Celebration Guns, Townies, Superdose Gangway, Farseek, Downhaul"
Square Loop,"The Fairview, Lilac Queen, Innerlove., sunstained, Stress Fractures"
Lau Ro,"Roberto Mendes, Antônio Neves, Jorge Autuori Trio, Jennifer Souza, Leonardo Marques"
Frat Mouse,"trsh, The Obsessives, Modern Baseball, saturdays at your place, macseal"
Shag Rock,"Mako Road, The Grogans, Bootleg Rascal, Pacific Avenue, Surf Trash"
Blind Willie Johnson,"Blind Willie McTell, Charley Patton, Son House, Robert Johnson, Big Bill Broonzy"
Cal in Red,"Lunar Isles, Cool Heat, Phantom Youth, dayaway, Vilde"
Pinhead Gunpowder,"The Network, Green Day, The Longshot, Billie Joe Armstrong, Crimpshrine"
The Numbers Tour: 1976–1977,"Aurora: 1977–1978, Debut: 1973–1975, The Rise of the Six: 1966–1972, Aurora World Tour: 1978–1979, Seven Eight Nine: 1975–1976"
The Strokes,"The Voidz, Julian Casablancas, Albert Hammond, Jr., Arctic Monkeys, Interpol"
Abby Jeanne,"GGOOLLDD, Noël Wells, Trapper Schoepp, Walker Lukens, Lady Lark"
Stories,"Northlane, Structures, Novelists, Void Of Vision, Reflections"
Bellini,"Paradisio, Kaoma, Captain Jack, Vengaboys, Hermes House Band"
Ezra Glatt,"Lomelda, Richy Mitch & The Coal Miners, searows, Leith Ross, Piper Toohey"
Ray Charles,"Otis Redding, Aretha Franklin, Sam Cooke, Louis Armstrong, Nina Simone"
Alex G,"The Skin Cells, alex g online, starry cat, sandy g archive, Micah Preite"
Chris Corsano,"Bill Orcutt, Chris Corsano & Bill Orcutt, Beings, Nate Wooley, Fred Lonberg-Holm & Jason Roebke, Joe McPhee"
"Tyler, the Creator","OFWGKTA, Kendrick Lamar, Earl Sweatshirt, Childish Gambino, MellowHype"
Korn,"Slipknot, Limp Bizkit, Jonathan Davis, Coal Chamber, Snot"
Matt Berry,"The Coral, Kevin Ayers, Hawkwind, Tim Heidecker, Flight of the Conchords"
Detention,"Freestone, Defnics, Cold Cock, Child Molesters, Vains"
Chapter Thirty-one,
Prostitute,"chat pile, The Jesus Lizard, Uniform, YHWH Nailgun, Melt-Banana"
Hannah Diamond,"Easyfun, Namasenda, Danny L Harle, GFOTY, caro♡"
Tunng,"The Weather Station, Moriarty, Bibio, Sam Amidon, The Leisure Society"
Joh Chase,"Morgan Harper-Jones, Bloomsday, Ghost Piss, gglum, Valley Queen"
Aneesa Folds,"Sasha Hutchings, Kenita Miller, Colman Domingo, James Remar, Utkarsh Ambudkar"
DIIV,"Beach Fossils, Wild Nothing, Launder, Flyying Colours, BDRMM"
Yot Club,"VACATIONS, Mind’s Eye, Vansire, late night drive home, Castlebeat"
Björk,"Arca, The Sugarcubes, Kate Bush, Eartheater, FKA twigs"
Sneaky Pete Kleinow,"Bobby Bond, Harry Dean Stanton, Mack Allen Smith, Jim Spencer, Buddy Emmons"
Ghost-Note,
Crumb,"Men I Trust, Melody's Echo Chamber, Mild High Club, no vacation, Sugar Candy Mountain"
Durry,"Matt Maeson, Briston Maroney, lovelytheband, The Wrecks, Joe P"
Naima Bock,"Allegra Krieger, Katy J Pearson, Laura Marling, Dana Gavanski, The Weather Station"
Linda Thompson,"Richard Thompson, June Tabor, Richard & Linda Thompson, Steeleye Span, Sandy Denny"
"S. Carey, John Raymond, Aaron Parks, Gordi","S. Carey, John Raymond, Aaron Parks, S. Carey, John Raymond, Gordi, S. Carey, John Raymond, S. Carey, John Raymond, Aaron Parks, Chris Morrissey, S. Carey"
Louie Zong,"Oliver Buckland, Nelward, Lena Raine, Calum Bowen, Spellcasting"
Judie Tzuke,"Joan Armatrading, Bruce Hornsby & the Range, Stevie Nicks, Gerry Rafferty, Wet Wet Wet"
Crass,"Subhumans, Conflict, Flux of Pink Indians, Dirt, Zounds"
Allie X,"slayyyter, ionnalee, Kim Petras, Sky Ferreira, Empress Of"
Sen Morimoto,"Kassa Overall, Resavoir, Amaro Freitas, Tierra Whack, Leo Takami"
Rebounder,"Ax and the Hatchetmen, The Hails, Hall Johnson, young friend, Landon Conrath"
Bomba Estéreo,"Systema Solar, Mitú, Choc Quib Town, Monsieur Periné, Aterciopelados"
"Samm Henshaw, EARTHGANG","Samm Henshaw, Wretch 32, Samm Henshaw, Keyon Harrold, Love Thy Brother, Ariel Beesley, Lostboycrow, Milkman, Samm Henshaw, Tobe Nwigwe"
Bob Dylan,"Bob Dylan and The Band, Bob Dylan & Johnny Cash, The Band, Neil Young, Joan Baez"
"YACHT, Classixx","DJ Mehdi, Outlines, Tony Castles, Kauf, The C90s, Flight Facilities, Age of Consent, Aaron Hall, Chris ""Tricky"" Stewart, Sean ""Sep"" Hall"
"Joey Quinones, Thee Sinseers","The Altons, Thee Sinseers, Joey Quinones, Thee Sinseers, Los Yesterday, Joey Quinones"
The Secret Sisters,"Brandi Carlile, Sarah Jarosz, The Highwomen, Aoife O'Donovan, Amanda Shires"
Home,"憂鬱, A.L.I.S.O.N, Memorex Memories, oDDling, Admo"
Cloud Signals,"Stayinbedpropaganda, Watson Moon, Sam Pacchioli, Leaf and Machine, Cactus Lee"
Thomas Flynn,"juliet sunflower, Jack M. Senff, Logan Bowden, Jon Middleton, Mary Elizabeth Remington"
fanclubwallet,"Krooked Kings, Midnight Faces, dad sports, The Greeting Committee, Social Animals"
Caravels,"Apart, Octaves, Calculator, Former Thieves, My Heart To Joy"
My Mercury,"annika kilkenny, Sam Wilkinson, Dominic Wright, Will Bryant, Essence Martins"
Auðura,"Tall Towers, Imala Zir, Garden Collective, Sun Of They, Agnes Lundh"
Black Mountain,"Dead Meadow, The Black Angels, Sleepy Sun, All Them Witches, Pink Mountaintops"
riley engemoen,"Common Loons, Natalie Jane HIll, Olivia Kaplan, Logan Bowden, Bermuda Triangle"
Lupe Fiasco,"Big K.R.I.T., Nas, Ab-Soul, Blu & Exile, The Roots"
Rahill,"shana cleveland, Hand Habits, Helado Negro, This Is the Kit, Buck Meek"
Dayborn,"Jackson Emmer, Ian Felice, Willy Tea Taylor, Kenny Knight, Senora May"
Johann Sebastian Bach,"Ludwig van Beethoven, Wolfgang Amadeus Mozart, Georg Friedrich Händel, Franz Schubert, Johannes Brahms"
Quadeca,"brakence, Injury Reserve, Mid-Air Thief, grouptherapy., JPEGMAFIA & Denzel Curry"
Fresh Dom,"BlackCode, RAIDH, Kara Queen, Skydrops, Patrick Moreno"
Mercury Rev,"The Flaming Lips, Super Furry Animals, Grandaddy, Primal Scream, Galaxie 500"
Mattie Leon,"Annie Sumi, Ken Yates, Martin Kerr, Tom West, Julian Taylor"
DUCKWRTH,
Chaka Khan,"Rufus, Patti LaBelle, Stephanie Mills, Patrice Rushen, Diana Ross"
