Artist,Similar Artists
Shannon Wright,"Elysian Fields, Scout Niblett, Kristin Hersh, Laura Veirs, Marissa Nadler"
Rats On Rafts,"The Homesick, Nouveau Velo, Bombay Show Pig, Nouveau Vélo, Anne Soldaat"
Krept & Konan,"Cadet, Giggs, Abra Cadabra, Yxng Bane, Kojo Funds"
"Swept Away Original Broadway Cast,The Avett Brothers",
Adwaith,"Buzzard Buzzard Buzzard, Melin Melyn, Gorky's Zygotic Mynci, Gruff Rhys, Super Furry Animals"
NATTI NATASHA,"Becky G, Karol G, Wisin, Greeicy, Nicky Jam"
The Bird Calls,"Sofia Wolfson, Bridget Kearney, Lindsay Reamer, Hannah Mohan, Michael Cormier-O'Leary"
Biig Piig,"Greentea Peng, Lava La Rue, Arlo Parks, Hope Tala, PIP MILLETT"
"Tony Allen,La BOA",
Diffrent,"Malugi, mischluft, Sammy Virji, main phase, Notion"
"Zelooperz,Real Bad Man",
The Ocelots,"Hunkpapa, Michael Dunstan, Little Hours, Oliver Daldry, The Bronze Medal"
Matt Pond PA,"Rogue Wave, Maritime, Longwave, Guster, The Long Winters"
"Kina Grannis,Imaginary Future,people i like,Mree,Henri Bardot",
AHI,"Aisha Badru, Beta Radio, Mipso, John Smith, Rosie Carney"
Dropkick,"The Primary 5, Danny and the Champions of the World, Cosmic Rough Riders, The Pearlfishers, Brett Detar"
Nadia Reid,"Aldous Harding, Heather Woods Broderick, This Is the Kit, Tiny Ruins, Marlon Williams"
Oklou,"Cecile Believe, Kelela, ML BUCH, caro♡, FKA twigs"
16,"Buzzov•en, Iron Monkey, Fistula, Crowbar, Black Cobra"
HORSEBATH,"Mariel Buckley, Steph Green, Duff Thompson, Jenny Don't and the Spurs, Andrew Gabbard"
Michigander,"Wilderado, Joe P, Krooked Kings, GRMLN, Your Neighbors"
Inhaler,"Sam Fender, Catfish and The Bottlemen, Blossoms, Wunderhorse, The 1975"
Olly Alexander (Years & Years),"Years & Years, Silvester Belt, Mustii, Kaleen, Nebulossa"
Matt Nathanson,"Mat Kearney, Howie Day, Joshua Radin, Five for Fighting, Gavin DeGraw"
Sharon Van Etten,"Angel Olsen, Julia Jacklin, Aldous Harding, Cat Power, Waxahatchee"
Death By Unga Bunga,"The Good The Bad and The Zugly, Blood Command, Spidergawd, Skambankt, Honningbarna"
Lewis Watson,"Luke Sital-Singh, Nick Mulvey, George Ogilvie, Gabrielle Aplin, Passenger"
"Traxman,Bobby Skillz,Sinjin Hawke",
James Brandon Lewis,"James Brandon Lewis Quartet, Joshua Redman, Henry Threadgill, Irreversible Entanglements, Lakecia Benjamin"
Low Roar,"Woodkid, Message To Bears, Amiina, Andrew Prahlow, Syd Matters"
"FROMTHEHEART,brakence,underscores",
Sam Moss,"Henri Bardot, I See Rivers, Hip Hatchet, Merival, All Our Exes live in Texas"
FACS,"Lifeguard, Mandy, Indiana, Stuck, Ditz, Bambara"
Johnnyswim,"Drew Holcomb & the Neighbors, The Lone Bellow, Wilder Woods, The Civil Wars, Penny and Sparrow"
Eugenia Choe,
Chloe Slater,"better joy, BBY, Etta Marcus, Bel, total tommy"
The Moles,"Richard Davies, Marmoset, Strapping Fieldhands, Eric Matthews, Blank Realm"
Guided By Voices,"Robert Pollard, Tobin Sprout, Boston Spaceships, Circus Devils, Sebadoh"
Heartworms,"Nightbus, Deadletter, Dog Race, Chalk, Gurriers"
Wilder Woods,"Nathaniel Rateliff & the Night Sweats, Johnnyswim, Abraham Alexander, The Revivalists, Allen Stone"
"Larry June,2 Chainz,The Alchemist",
Adrian Crowley,"Begushkin, Beatbeat Whisper, Chriss Sutherland, Peasant, JBM"
Skeleten,"total tommy, Real Lies, Heartworms, Gilligan Moss, dayaway"
Sleeper's Bell,"Dari Bay, The Lost Days, Steve Marino, Rose Hotel, Dead Gowns"
Squid,"Shame, BLACK MIDI, Squid & Martha Skye Murphy, Geese, Black Country, New Road"
"Tom Speight,The Mayries",
Ali Omar,"Itch-E & Scratch-E, Waikiki, G.O.G & The Necerending Fairy Familie, Atone, Bjork With Dave Arnold"
