Artist,Similar Artists,status
MIKE,"DJ BlackPower, Niontay, Navy Blue, pink siifu, Mavi",success
The Head And The Heart,"Caamp, The Lumineers, Blind Pilot, Mt. Joy, Vance Joy",success
André 3000,"OutKast, NoName, The Alchemist, Genesis Owusu, Earl Sweatshirt & The Alchemist",success
Cuco,"boy pablo, Banes World, VACATIONS, mellow fellow, TEMPOREX",success
Maren Morris,"Kelsea Ballerini, Miranda Lambert, Carly Pearce, Ingrid Andress, Carrie Underwood",success
Kali Uchis,"SZA, Doja Cat, omar apollo, pinkpantheress, Chloe x Halle",success
I'm With Her,"Aoife O'Donovan, Crooked Still, Sarah Jarosz, Sara Watkins, Caitlin Canty",success
Brandon,"Freeweights, Dream Shore, Juno Dreams, Saffari, Nightstop",success
Caitlin Cannon,"Charlie Marie, Ben Jarrell, Whitney Rose, Erin Enderlin, Victoria Bailey",success
Jack Van Cleaf,"Sam Burchfield, Daniel Nunnelee, Elias Hix, Sumbuck, Caamp",success
Maia Friedman,"Malena Zavala, Ex-Vöid, Katy Kirby, Matilda Mann, Marina Allen",success
Spacey Jane,"Lime Cordiale, Pacific Avenue, The Rions, The Jungle Giants, Rum Jungle",success
The Wonder Years,"Spanish Love Songs, Real Friends, Fireworks, Knuckle Puck, Hot Mulligan",success
Sleep Token,"breakk.away, Bad Omens, SpiritBox, Memorist, Sleep Theory",success
Arcade Fire,"Vampire Weekend, The National, The Shins, Interpol, Wolf Parade",success
Deradoorian,"Avey Tare, Anika, Panda Bear, Avey Tare's Slasher Flicks, Unknown Mortal Orchestra",success
Preoccupations,"Viet Cong, Protomartyr, Ought, Iceage, Omni",success
billy woods,"Armand Hammer, Billy Woods & Kenny Segal, E L U C I D, Armand Hammer & The Alchemist, Mach-Hommy",success
Tetrarch,"Chaoseum, Ded, Tallah, My Enemies & I, Death Blooms",success
Jlin,"HEAVEE, RP Boo, Actress, Loraine James, DJ Rashad",success
Venetian Snares,"Doormouse, Last Step, Ruby My Dear, Xanopticon, Squarepusher",success
Traxman,"DJ Rashad, RP Boo, DJ Earl, DJ Manny, DJ Spinn",success
Nondi_,"DJ Manny, Jlin, HEAVEE, DJ Rashad, RP Boo",success
FaltyDL,"Scuba, Actress, Martyn, Pearson Sound, Sepalcure",success
Rev,"purge!, Hxzz, Asta, TH3 KXD, Cutty Vibez",success
BAE BAE,"Midget Ninjas, ARIEL ZETINA, Montagem, Jasmine Infiniti, Nerú Americano",success
Slikback,"Aïsha Devi, 33EMYBW, Amnesia Scanner, Hyph11E, Osheyack",success
µ-Ziq,"Squarepusher, Kid Spatula, Jega, Cylob, Plaid",success
RP Boo,"DJ Rashad, DJ Spinn, Traxman, DJ Manny, cakedog",success
DJ Manny,"DJ Earl, DJ Rashad, DJ Spinn, RP Boo, Traxman",success
Saint Abdullah,"Metal Preyers, Abdullah Miniawy, Pollution Opera, Wojciech Rusin, Dis Fig",success
Nik Colk Void,"Carter Tutti Void, Gabe Gurnsey, Shelley Parker, Wojciech Rusin, MICROCORPS",success
DJ Elmoe,"cakedog, DJ Clent, DJ Nate, DJ Rashad, DJ Spinn",success
Meemo Comma,"µ-Ziq, Whatever The Weather, Kaito, Photay, Perila",success
Herva,"Svreca, Ekoplekz, Fis, Afrikan Sciences, Andrea Belfi",success
Xylitol,"Marie Davidson, Modern Living, MEEMO COMMA, µ-Ziq, Antonina Nowacka",success
Jana Rush,"RP Boo, DJ Paypal, Traxman, DJ Manny, DJ Rashad",success
Luke Vibert,"Wagon Christ, Plug, Ceephax Acid Crew, Cylob, AFX",success
James Krivchenia,"Byn Vacum, Delmer Darion, bottlesmoker, Tigerclub, Original Broadway Cast of 'Hamilton'",success
Rian Treanor,"Gábor Lázár, Mark Fell, SND, Rian Treanor & Ocen James, Jlin",success
THE BOBBY LEES,"SURFBORT, R.M.F.C., Teen Mortgage, Le Butcherettes, Aborted Tortoise",success
Men I Trust,"Tokyo Tea Room, The Marías, Crumb, no vacation, Bernache",success
Mark Pritchard,"Steve Hauschildt, Herbert, Kaitlyn Aurelia Smith, Harmonic 313, Clark",success
Erika de Casier,"Kelela, Rochelle Jordan, amaarae, Tinashe, George Riley",success
SAILORR,"kwn, Coco Jones, FLO, Destin Conrad, Summer Walker",success
Dexter and The Moonrocks,"hey, nothing, Jack Kays, saturdays at your place, Wilderado, Sorority Noise",success
The Kooks,"The Wombats, Razorlight, Kaiser Chiefs, The Pigeon Detectives, The Fratellis",success
Forrest Frank,"Hulvey, Josiah Queen, Gio., Lecrae, nobigdyl.",success
Catbite,"BAD OPERATION, Flying Raccoon Suit, We Are The Union, OMNIGONE, Kill Lincoln",success
Alien Boy,"Stove, Webbed Wing, Happy Diving, Bully, Speedy Ortiz",success
Knowledge the Pirate,"V Don, Daniel Son, Rigz, Ufo Fev, nowaah the flood",success
Unwed Sailor,"Signal Hill, Tristeza, Saxon Shore, The Six Parts Seven, The Mercury Program",success
Nils Frahm,"Ólafur Arnalds & Nils Frahm, Ólafur Arnalds, A Winged Victory for the Sullen, Ben Lukas Boysen, hania rani",success
Alex Orange Drink,"The So So Glos, Son, Ambulance, UV-TV, Rodeo Boys, Native Sun",success
Boyfriend,"Infinite, TEEN TOP, B1A4, Beast, MBLAQ",success
Duke Dumont,"Gorgon City, Disciples, CamelPhat, Route 94, Elderbrook",success
Maruja,"Ugly (UK), Black Country, New Road, Squid, Model/Actriz, BLACK MIDI",success
The Chain,"Jack Dixon, Fantastic Mr Fox, Eliphino, J.O.Y., Boddika & Joy Orbison",success
Joe Goddard,"Hot Chip, Agoria, The Blessed Madonna, Caribou, Tsha",success
Night Heron,"Depeche Mode, Ludwig A.F., M A N E, Howling, Frank Wiedemann, RY X, Mat&Ritchie, 3 A.M. Again",success
La Dispute,"Touché Amoré, Pianos Become the Teeth, mewithoutYou, Chiodos, Old Gray",success
KALEO,"Welshly Arms, Barns Courtney, Royal Deluxe, Black Pistol Fire, The Blue Stones",success
